"plot","pont","peso.seco","peso.saco","peso.flor_g","peso.fruto_g","peso.galho_g","peso.folha_g","data","obs","date2","years","months","days","weight_g"
"E21","A",17.16,7.73,,,,,"01/09/2011",,2011-09-01,"2011","09","01",9.43
"E21","B",26.83,7.73,,,,,"01/09/2011",,2011-09-01,"2011","09","01",19.1
"E21","C",39.38,7.73,,,,,"01/09/2011",,2011-09-01,"2011","09","01",31.65
"E21","D",23.61,7.73,,,,,"01/09/2011",,2011-09-01,"2011","09","01",15.88
"E22","A",37.88,7.73,,,,,"01/09/2011",,2011-09-01,"2011","09","01",30.15
"E22","B",23.9,7.73,,,,,"01/09/2011",,2011-09-01,"2011","09","01",16.17
"E22","C",20.06,7.73,,,,,"01/09/2011",,2011-09-01,"2011","09","01",12.33
"E22","D",34.77,7.73,,,,,"01/09/2011",,2011-09-01,"2011","09","01",27.04
"E26","A",14.81,7.73,,,,,"01/09/2011",,2011-09-01,"2011","09","01",7.08
"E26","B",32.44,7.73,,,,,"01/09/2011",,2011-09-01,"2011","09","01",24.71
"E26","C",16.15,7.73,,,,,"01/09/2011",,2011-09-01,"2011","09","01",8.42
"E26","D",24.64,7.73,,,,,"01/09/2011",,2011-09-01,"2011","09","01",16.91
"E27","A",15.68,7.73,,,,,"01/09/2011",,2011-09-01,"2011","09","01",7.95
"E27","B",34.96,7.73,,,,,"01/09/2011",,2011-09-01,"2011","09","01",27.23
"E27","C",29.58,7.73,,,,,"01/09/2011",,2011-09-01,"2011","09","01",21.85
"E27","D",22.02,7.73,,,,,"01/09/2011",,2011-09-01,"2011","09","01",14.29
"F21","A",27.5,7.73,,,,,"01/09/2011",,2011-09-01,"2011","09","01",19.77
"F21","B",48.5,7.73,,,,,"01/09/2011",,2011-09-01,"2011","09","01",40.77
"F21","C",24.17,7.73,,,,,"01/09/2011",,2011-09-01,"2011","09","01",16.44
"F21","D",15.73,7.73,,,,,"01/09/2011",,2011-09-01,"2011","09","01",8
"F22","A",24.08,7.73,,,,,"01/09/2011",,2011-09-01,"2011","09","01",16.35
"F22","B",24.36,7.73,,,,,"01/09/2011",,2011-09-01,"2011","09","01",16.63
"F22","C",12.32,7.73,,,,,"01/09/2011",,2011-09-01,"2011","09","01",4.59
"F22","D",15.87,7.73,,,,,"01/09/2011",,2011-09-01,"2011","09","01",8.14
"F26","A",22.58,7.73,,,,,"01/09/2011",,2011-09-01,"2011","09","01",14.85
"F26","B",15.45,7.73,,,,,"01/09/2011",,2011-09-01,"2011","09","01",7.72
"F26","C",25.74,7.73,,,,,"01/09/2011",,2011-09-01,"2011","09","01",18.01
"F26","D",17.68,7.73,,,,,"01/09/2011",,2011-09-01,"2011","09","01",9.95
"F27","A",27.16,7.73,,,,,"01/09/2011",,2011-09-01,"2011","09","01",19.43
"F27","B",21.89,7.73,,,,,"01/09/2011",,2011-09-01,"2011","09","01",14.16
"F27","C",30.51,7.73,,,,,"01/09/2011",,2011-09-01,"2011","09","01",22.78
"F27","D",36.77,7.73,,,,,"01/09/2011",,2011-09-01,"2011","09","01",29.04
"J21","A",25.73,7.73,,,,,"01/09/2011",,2011-09-01,"2011","09","01",18
"J21","B",52.78,7.73,,,,,"01/09/2011",,2011-09-01,"2011","09","01",45.05
"J21","C",22.78,7.73,,,,,"01/09/2011",,2011-09-01,"2011","09","01",15.05
"J21","D",14.83,7.73,,,,,"01/09/2011",,2011-09-01,"2011","09","01",7.1
"J22","A",24.83,7.73,,,,,"01/09/2011",,2011-09-01,"2011","09","01",17.1
"J22","B",21.34,7.73,,,,,"01/09/2011",,2011-09-01,"2011","09","01",13.61
"J22","C",34.02,7.73,,,,,"01/09/2011",,2011-09-01,"2011","09","01",26.29
"J22","D",21.59,7.73,,,,,"01/09/2011",,2011-09-01,"2011","09","01",13.86
"J26","A",21.97,7.73,,,,,"01/09/2011",,2011-09-01,"2011","09","01",14.24
"J26","B",27.58,7.73,,,,,"01/09/2011",,2011-09-01,"2011","09","01",19.85
"J26","C",20.77,7.73,,,,,"01/09/2011",,2011-09-01,"2011","09","01",13.04
"J26","D",16.05,7.73,,,,,"01/09/2011",,2011-09-01,"2011","09","01",8.32
"J27","A",16.21,7.73,,,,,"01/09/2011",,2011-09-01,"2011","09","01",8.48
"J27","B",19.13,7.73,,,,,"01/09/2011",,2011-09-01,"2011","09","01",11.4
"J27","C",23.94,7.73,,,,,"01/09/2011",,2011-09-01,"2011","09","01",16.21
"J27","D",31.98,7.73,,,,,"01/09/2011",,2011-09-01,"2011","09","01",24.25
"K21","A",20.33,7.73,,,,,"01/09/2011",,2011-09-01,"2011","09","01",12.6
"K21","B",28.64,7.73,,,,,"01/09/2011",,2011-09-01,"2011","09","01",20.91
"K21","C",33.39,7.73,,,,,"01/09/2011",,2011-09-01,"2011","09","01",25.66
"K21","D",19.63,7.73,,,,,"01/09/2011",,2011-09-01,"2011","09","01",11.9
"K22","A",25.62,7.73,,,,,"01/09/2011",,2011-09-01,"2011","09","01",17.89
"K22","B",30.87,7.73,,,,,"01/09/2011",,2011-09-01,"2011","09","01",23.14
"K22","C",33.23,7.73,,,,,"01/09/2011",,2011-09-01,"2011","09","01",25.5
"K22","D",18.99,7.73,,,,,"01/09/2011",,2011-09-01,"2011","09","01",11.26
"K26","A",15.7,7.73,,,,,"01/09/2011",,2011-09-01,"2011","09","01",7.97
"K26","B",15.12,7.73,,,,,"01/09/2011",,2011-09-01,"2011","09","01",7.39
"K26","C",19.83,7.73,,,,,"01/09/2011",,2011-09-01,"2011","09","01",12.1
"K26","D",20.53,7.73,,,,,"01/09/2011",,2011-09-01,"2011","09","01",12.8
"K27","A",18.71,7.73,,,,,"01/09/2011",,2011-09-01,"2011","09","01",10.98
"K27","B",27.56,7.73,,,,,"01/09/2011",,2011-09-01,"2011","09","01",19.83
"K27","C",26.45,7.73,,,,,"01/09/2011",,2011-09-01,"2011","09","01",18.72
"K27","D",25.02,7.73,,,,,"01/09/2011",,2011-09-01,"2011","09","01",17.29
"E21","A",16.7,7.48,,,,,"15/09/2011",,2011-09-15,"2011","09","15",9.22
"E21","B",29.49,7.48,,,,,"15/09/2011",,2011-09-15,"2011","09","15",22.01
"E21","C",28.88,7.48,,,,,"15/09/2011",,2011-09-15,"2011","09","15",21.4
"E21","D",19.63,7.48,,,,,"15/09/2011",,2011-09-15,"2011","09","15",12.15
"E22","A",19.17,7.48,,,,,"15/09/2011",,2011-09-15,"2011","09","15",11.69
"E22","B",25.64,7.48,,,,,"15/09/2011",,2011-09-15,"2011","09","15",18.16
"E22","C",16.91,7.48,,,,,"15/09/2011",,2011-09-15,"2011","09","15",9.43
"E22","D",20.65,7.48,,,,,"15/09/2011",,2011-09-15,"2011","09","15",13.17
"E26","A",20.4,7.48,,,,,"15/09/2011",,2011-09-15,"2011","09","15",12.92
"E26","B",89.79,7.48,,,,,"15/09/2011",,2011-09-15,"2011","09","15",82.31
"E26","C",14.48,7.48,,,,,"15/09/2011",,2011-09-15,"2011","09","15",7
"E26","D",31.33,7.48,,,,,"15/09/2011",,2011-09-15,"2011","09","15",23.85
"E27","A",21.2,7.48,,,,,"15/09/2011",,2011-09-15,"2011","09","15",13.72
"E27","B",21.25,7.48,,,,,"15/09/2011",,2011-09-15,"2011","09","15",13.77
"E27","C",26.58,7.48,,,,,"15/09/2011",,2011-09-15,"2011","09","15",19.1
"E27","D",28.44,7.48,,,,,"15/09/2011",,2011-09-15,"2011","09","15",20.96
"F21","A",28.96,7.48,,,,,"15/09/2011",,2011-09-15,"2011","09","15",21.48
"F21","B",35.23,7.48,,,,,"15/09/2011",,2011-09-15,"2011","09","15",27.75
"F21","C",19.23,7.48,,,,,"15/09/2011",,2011-09-15,"2011","09","15",11.75
"F21","D",17.78,7.48,,,,,"15/09/2011",,2011-09-15,"2011","09","15",10.3
"F22","A",34.81,7.48,,,,,"15/09/2011",,2011-09-15,"2011","09","15",27.33
"F22","B",25.74,7.48,,,,,"15/09/2011",,2011-09-15,"2011","09","15",18.26
"F22","C",15.07,7.48,,,,,"15/09/2011",,2011-09-15,"2011","09","15",7.59
"F22","D",21.16,7.48,,,,,"15/09/2011",,2011-09-15,"2011","09","15",13.68
"F26","A",20.63,7.48,,,,,"15/09/2011",,2011-09-15,"2011","09","15",13.15
"F26","B",14.71,7.48,,,,,"15/09/2011",,2011-09-15,"2011","09","15",7.23
"F26","C",36.25,7.48,,,,,"15/09/2011",,2011-09-15,"2011","09","15",28.77
"F26","D",23.69,7.48,,,,,"15/09/2011",,2011-09-15,"2011","09","15",16.21
"F27","A",20.54,7.48,,,,,"15/09/2011",,2011-09-15,"2011","09","15",13.06
"F27","B",34.89,7.48,,,,,"15/09/2011",,2011-09-15,"2011","09","15",27.41
"F27","C",15.23,7.48,,,,,"15/09/2011",,2011-09-15,"2011","09","15",7.75
"F27","D",32.46,7.48,,,,,"15/09/2011",,2011-09-15,"2011","09","15",24.98
"J21","A",20.84,7.48,,,,,"15/09/2011",,2011-09-15,"2011","09","15",13.36
"J21","B",42.22,7.48,,,,,"15/09/2011",,2011-09-15,"2011","09","15",34.74
"J21","C",25.68,7.48,,,,,"15/09/2011",,2011-09-15,"2011","09","15",18.2
"J21","D",16.54,7.48,,,,,"15/09/2011",,2011-09-15,"2011","09","15",9.06
"J22","A",19.53,7.48,,,,,"15/09/2011",,2011-09-15,"2011","09","15",12.05
"J22","B",16.5,7.48,,,,,"15/09/2011",,2011-09-15,"2011","09","15",9.02
"J22","C",24.7,7.48,,,,,"15/09/2011",,2011-09-15,"2011","09","15",17.22
"J22","D",23.67,7.48,,,,,"15/09/2011",,2011-09-15,"2011","09","15",16.19
"J26","A",16.69,7.48,,,,,"15/09/2011",,2011-09-15,"2011","09","15",9.21
"J26","B",19.98,7.48,,,,,"15/09/2011",,2011-09-15,"2011","09","15",12.5
"J26","C",17.48,7.48,,,,,"15/09/2011",,2011-09-15,"2011","09","15",10
"J26","D",25.17,7.48,,,,,"15/09/2011",,2011-09-15,"2011","09","15",17.69
"J27","A",17.2,7.48,,,,,"15/09/2011",,2011-09-15,"2011","09","15",9.72
"J27","B",18.71,7.48,,,,,"15/09/2011",,2011-09-15,"2011","09","15",11.23
"J27","C",22.39,7.48,,,,,"15/09/2011",,2011-09-15,"2011","09","15",14.91
"J27","D",29.33,7.48,,,,,"15/09/2011",,2011-09-15,"2011","09","15",21.85
"K21","A",23.41,7.48,,,,,"15/09/2011",,2011-09-15,"2011","09","15",15.93
"K21","B",25.94,7.48,,,,,"15/09/2011",,2011-09-15,"2011","09","15",18.46
"K21","C",25.67,7.48,,,,,"15/09/2011",,2011-09-15,"2011","09","15",18.19
"K21","D",31.2,7.48,,,,,"15/09/2011",,2011-09-15,"2011","09","15",23.72
"K22","A",25.67,7.48,,,,,"15/09/2011",,2011-09-15,"2011","09","15",18.19
"K22","B",32.83,7.48,,,,,"15/09/2011",,2011-09-15,"2011","09","15",25.35
"K22","C",27.96,7.48,,,,,"15/09/2011",,2011-09-15,"2011","09","15",20.48
"K22","D",16.93,7.48,,,,,"15/09/2011",,2011-09-15,"2011","09","15",9.45
"K26","A",18.4,7.48,,,,,"15/09/2011",,2011-09-15,"2011","09","15",10.92
"K26","B",15.62,7.48,,,,,"15/09/2011",,2011-09-15,"2011","09","15",8.14
"K26","C",15.29,7.48,,,,,"15/09/2011",,2011-09-15,"2011","09","15",7.81
"K26","D",16.99,7.48,,,,,"15/09/2011",,2011-09-15,"2011","09","15",9.51
"K27","A",18.42,7.48,,,,,"15/09/2011",,2011-09-15,"2011","09","15",10.94
"K27","B",21.53,7.48,,,,,"15/09/2011",,2011-09-15,"2011","09","15",14.05
"K27","C",16.01,7.48,,,,,"15/09/2011",,2011-09-15,"2011","09","15",8.53
"K27","D",29.93,7.48,,,,,"15/09/2011",,2011-09-15,"2011","09","15",22.45
"E21","A",28.97,7.65,,,,,"01/10/2011",,2011-10-01,"2011","10","01",21.32
"E21","B",31.47,7.65,,,,,"01/10/2011",,2011-10-01,"2011","10","01",23.82
"E21","C",37.6,7.65,,,,,"01/10/2011",,2011-10-01,"2011","10","01",29.95
"E21","D",49.33,7.65,,,,,"01/10/2011",,2011-10-01,"2011","10","01",41.68
"E22","A",17.86,7.65,,,,,"01/10/2011",,2011-10-01,"2011","10","01",10.21
"E22","B",28.55,7.65,,,,,"01/10/2011",,2011-10-01,"2011","10","01",20.9
"E22","C",24.36,7.65,,,,,"01/10/2011",,2011-10-01,"2011","10","01",16.71
"E22","D",34.81,7.65,,,,,"01/10/2011",,2011-10-01,"2011","10","01",27.16
"E26","A",41.02,7.65,,,,,"01/10/2011",,2011-10-01,"2011","10","01",33.37
"E26","B",41.55,7.65,,,,,"01/10/2011",,2011-10-01,"2011","10","01",33.9
"E26","C",23.35,7.65,,,,,"01/10/2011",,2011-10-01,"2011","10","01",15.7
"E26","D",44.04,7.65,,,,,"01/10/2011",,2011-10-01,"2011","10","01",36.39
"E27","A",29.46,7.65,,,,,"01/10/2011",,2011-10-01,"2011","10","01",21.81
"E27","B",24.07,7.65,,,,,"01/10/2011",,2011-10-01,"2011","10","01",16.42
"E27","C",27.3,7.65,,,,,"01/10/2011",,2011-10-01,"2011","10","01",19.65
"E27","D",42.06,7.65,,,,,"01/10/2011",,2011-10-01,"2011","10","01",34.41
"F21","A",33.8,7.65,,,,,"01/10/2011",,2011-10-01,"2011","10","01",26.15
"F21","B",35.89,7.65,,,,,"01/10/2011",,2011-10-01,"2011","10","01",28.24
"F21","C",24.6,7.65,,,,,"01/10/2011",,2011-10-01,"2011","10","01",16.95
"F21","D",28.55,7.65,,,,,"01/10/2011",,2011-10-01,"2011","10","01",20.9
"F22","A",39.77,7.65,,,,,"01/10/2011",,2011-10-01,"2011","10","01",32.12
"F22","B",45.91,7.65,,,,,"01/10/2011",,2011-10-01,"2011","10","01",38.26
"F22","C",26.93,7.65,,,,,"01/10/2011",,2011-10-01,"2011","10","01",19.28
"F22","D",33.16,7.65,,,,,"01/10/2011",,2011-10-01,"2011","10","01",25.51
"F26","A",32.46,7.65,,,,,"01/10/2011",,2011-10-01,"2011","10","01",24.81
"F26","B",16.28,7.65,,,,,"01/10/2011",,2011-10-01,"2011","10","01",8.63
"F26","C",41.32,7.65,,,,,"01/10/2011",,2011-10-01,"2011","10","01",33.67
"F26","D",17.82,7.65,,,,,"01/10/2011",,2011-10-01,"2011","10","01",10.17
"F27","A",0,0,,,,,"01/10/2011",,2011-10-01,"2011","10","01",0
"F27","B",66.9,7.65,,,,,"01/10/2011",,2011-10-01,"2011","10","01",59.25
"F27","C",20.72,7.65,,,,,"01/10/2011",,2011-10-01,"2011","10","01",13.07
"F27","D",26.25,7.65,,,,,"01/10/2011",,2011-10-01,"2011","10","01",18.6
"J21","A",33.7,7.65,,,,,"01/10/2011",,2011-10-01,"2011","10","01",26.05
"J21","B",37.41,7.65,,,,,"01/10/2011",,2011-10-01,"2011","10","01",29.76
"J21","C",29.11,7.65,,,,,"01/10/2011",,2011-10-01,"2011","10","01",21.46
"J21","D",27.66,7.65,,,,,"01/10/2011",,2011-10-01,"2011","10","01",20.01
"J22","A",23.54,7.65,,,,,"01/10/2011",,2011-10-01,"2011","10","01",15.89
"J22","B",24.95,7.65,,,,,"01/10/2011",,2011-10-01,"2011","10","01",17.3
"J22","C",29.14,7.65,,,,,"01/10/2011",,2011-10-01,"2011","10","01",21.49
"J22","D",29.95,7.65,,,,,"01/10/2011",,2011-10-01,"2011","10","01",22.3
"J26","A",25.68,7.65,,,,,"01/10/2011",,2011-10-01,"2011","10","01",18.03
"J26","B",25.79,7.65,,,,,"01/10/2011",,2011-10-01,"2011","10","01",18.14
"J26","C",27.84,7.65,,,,,"01/10/2011",,2011-10-01,"2011","10","01",20.19
"J26","D",34.71,7.65,,,,,"01/10/2011",,2011-10-01,"2011","10","01",27.06
"J27","A",31.79,7.65,,,,,"01/10/2011",,2011-10-01,"2011","10","01",24.14
"J27","B",33.84,7.65,,,,,"01/10/2011",,2011-10-01,"2011","10","01",26.19
"J27","C",34.88,7.65,,,,,"01/10/2011",,2011-10-01,"2011","10","01",27.23
"J27","D",26.55,7.65,,,,,"01/10/2011",,2011-10-01,"2011","10","01",18.9
"K21","A",36.52,7.65,,,,,"01/10/2011",,2011-10-01,"2011","10","01",28.87
"K21","B",41.7,7.65,,,,,"01/10/2011",,2011-10-01,"2011","10","01",34.05
"K21","C",36.08,7.65,,,,,"01/10/2011",,2011-10-01,"2011","10","01",28.43
"K21","D",34.76,7.65,,,,,"01/10/2011",,2011-10-01,"2011","10","01",27.11
"K22","A",32.23,7.65,,,,,"01/10/2011",,2011-10-01,"2011","10","01",24.58
"K22","B",29.5,7.65,,,,,"01/10/2011",,2011-10-01,"2011","10","01",21.85
"K22","C",24.39,7.65,,,,,"01/10/2011",,2011-10-01,"2011","10","01",16.74
"K22","D",33.14,7.65,,,,,"01/10/2011",,2011-10-01,"2011","10","01",25.49
"K26","A",51.08,7.65,,,,,"01/10/2011",,2011-10-01,"2011","10","01",43.43
"K26","B",24.31,7.65,,,,,"01/10/2011",,2011-10-01,"2011","10","01",16.66
"K26","C",27.76,7.65,,,,,"01/10/2011",,2011-10-01,"2011","10","01",20.11
"K26","D",30.22,7.65,,,,,"01/10/2011",,2011-10-01,"2011","10","01",22.57
"K27","A",19.32,7.65,,,,,"01/10/2011",,2011-10-01,"2011","10","01",11.67
"K27","B",33.2,7.65,,,,,"01/10/2011",,2011-10-01,"2011","10","01",25.55
"K27","C",33.28,7.65,,,,,"01/10/2011",,2011-10-01,"2011","10","01",25.63
"K27","D",39.46,7.65,,,,,"01/10/2011",,2011-10-01,"2011","10","01",31.81
"E21","A",13.72,7.85,0,0,0.3,6.14,"17/10/2011",,2011-10-17,"2011","10","17",5.87
"E21","B",25.69,7.85,0,10.74,4.59,2.36,"17/10/2011",,2011-10-17,"2011","10","17",17.84
"E21","C",16.12,7.85,0.25,2.1,0.87,3.31,"17/10/2011",,2011-10-17,"2011","10","17",8.27
"E21","D",15.65,7.85,0,0.16,1.76,2.5,"17/10/2011",,2011-10-17,"2011","10","17",7.8
"E22","A",12.32,7.85,0,0.13,0.62,9.83,"17/10/2011",,2011-10-17,"2011","10","17",4.47
"E22","B",20.14,7.85,0,0,0.03,11.21,"17/10/2011",,2011-10-17,"2011","10","17",12.29
"E22","C",19.78,7.85,0,0,1.87,10.55,"17/10/2011",,2011-10-17,"2011","10","17",11.93
"E22","D",66.83,7.85,0,0.04,32.7,28.37,"17/10/2011",,2011-10-17,"2011","10","17",58.98
"E26","A",15.78,7.85,0,1.07,0.74,4.56,"17/10/2011",,2011-10-17,"2011","10","17",7.93
"E26","B",34.63,7.85,0,0.32,0.24,13,"17/10/2011",,2011-10-17,"2011","10","17",26.78
"E26","C",10.22,7.85,0,0.27,0,2.41,"17/10/2011",,2011-10-17,"2011","10","17",2.37
"E26","D",17.19,7.85,0,0,1.65,8.14,"17/10/2011",,2011-10-17,"2011","10","17",9.34
"E27","A",15.96,7.85,0,0,0.19,8.58,"17/10/2011",,2011-10-17,"2011","10","17",8.11
"E27","B",13.3,7.85,0,0.58,0.31,4.9,"17/10/2011",,2011-10-17,"2011","10","17",5.45
"E27","C",13.28,7.85,0,0,2.22,4.11,"17/10/2011",,2011-10-17,"2011","10","17",5.43
"E27","D",17.39,7.85,0.11,0.51,0.34,6.11,"17/10/2011",,2011-10-17,"2011","10","17",9.54
"F21","A",11.73,7.85,0,0,1.18,2.95,"17/10/2011",,2011-10-17,"2011","10","17",3.88
"F21","B",16.18,7.85,0,0,3.95,4.49,"17/10/2011",,2011-10-17,"2011","10","17",8.33
"F21","C",15.13,7.85,0,0.41,0.36,7.09,"17/10/2011",,2011-10-17,"2011","10","17",7.28
"F21","D",14.28,7.85,0,0.06,0.07,6.52,"17/10/2011",,2011-10-17,"2011","10","17",6.43
"F22","A",14.23,7.85,0,0.4,0.01,6.53,"17/10/2011",,2011-10-17,"2011","10","17",6.38
"F22","B",19.86,7.85,0,0.42,0.22,11.88,"17/10/2011",,2011-10-17,"2011","10","17",12.01
"F22","C",17.13,7.85,0,0,2.3,7.59,"17/10/2011",,2011-10-17,"2011","10","17",9.28
"F22","D",12.8,7.85,0,0,0.17,5.36,"17/10/2011",,2011-10-17,"2011","10","17",4.95
"F26","A",17.73,7.85,0,0.69,0.68,9.15,"17/10/2011",,2011-10-17,"2011","10","17",9.88
"F26","B",9.77,7.85,0,0,0.11,2.21,"17/10/2011",,2011-10-17,"2011","10","17",1.92
"F26","C",18.56,7.85,0,0.18,0.16,8.81,"17/10/2011",,2011-10-17,"2011","10","17",10.71
"F26","D",13.82,7.85,0,0.05,0.82,5.45,"17/10/2011",,2011-10-17,"2011","10","17",5.97
"F27","A",11.31,7.85,0,0,0.03,3.83,"17/10/2011",,2011-10-17,"2011","10","17",3.46
"F27","B",17.84,7.85,0,0.26,5.18,5.27,"17/10/2011",,2011-10-17,"2011","10","17",9.99
"F27","C",25.54,7.85,0,0,0.12,18.5,"17/10/2011",,2011-10-17,"2011","10","17",17.69
"F27","D",12.89,7.85,0,0,0.36,3.94,"17/10/2011",,2011-10-17,"2011","10","17",5.04
"J21","A",16.06,7.85,0,0,1.89,6.76,"17/10/2011",,2011-10-17,"2011","10","17",8.21
"J21","B",14.84,7.85,0,0,0.26,7.42,"17/10/2011",,2011-10-17,"2011","10","17",6.99
"J21","C",18.21,7.85,0,1.54,0.86,6.25,"17/10/2011",,2011-10-17,"2011","10","17",10.36
"J21","D",16.87,7.85,0,3.76,1.3,2.43,"17/10/2011",,2011-10-17,"2011","10","17",9.02
"J22","A",18.03,7.85,0,0,0.49,9.96,"17/10/2011",,2011-10-17,"2011","10","17",10.18
"J22","B",15.16,7.85,0,0,1.4,7.61,"17/10/2011",,2011-10-17,"2011","10","17",7.31
"J22","C",12.34,7.85,0,0.04,0.4,3.66,"17/10/2011",,2011-10-17,"2011","10","17",4.49
"J22","D",12.11,7.85,0,0,1.1,2.96,"17/10/2011",,2011-10-17,"2011","10","17",4.26
"J26","A",15.98,7.85,0,0,0.73,7.68,"17/10/2011",,2011-10-17,"2011","10","17",8.13
"J26","B",13.85,7.85,0,0,0.19,5.99,"17/10/2011",,2011-10-17,"2011","10","17",6
"J26","C",16.15,7.85,0,0,0.24,9.44,"17/10/2011",,2011-10-17,"2011","10","17",8.3
"J26","D",22.51,7.85,0,0.25,0.89,14.16,"17/10/2011",,2011-10-17,"2011","10","17",14.66
"J27","A",18.22,7.85,0,0.26,0.08,10.71,"17/10/2011",,2011-10-17,"2011","10","17",10.37
"J27","B",14.45,7.85,0,0,0.11,7.17,"17/10/2011",,2011-10-17,"2011","10","17",6.6
"J27","C",18.8,7.85,0,18.98,0.51,8.66,"17/10/2011",,2011-10-17,"2011","10","17",10.95
"J27","D",16.53,7.85,0,0.4,0.09,8.87,"17/10/2011",,2011-10-17,"2011","10","17",8.68
"K21","A",23.34,7.85,0,1.34,2.98,12.2,"17/10/2011",,2011-10-17,"2011","10","17",15.49
"K21","B",16.79,7.85,0,1.46,2.56,5.54,"17/10/2011",,2011-10-17,"2011","10","17",8.94
"K21","C",33.65,7.85,0,0,3.52,23.52,"17/10/2011",,2011-10-17,"2011","10","17",25.8
"K21","D",13.04,7.85,0.43,0,0.71,4.69,"17/10/2011",,2011-10-17,"2011","10","17",5.19
"K22","A",16.39,7.85,0.22,0.16,0.26,5.98,"17/10/2011",,2011-10-17,"2011","10","17",8.54
"K22","B",16.99,7.85,0,1.04,2.38,5.26,"17/10/2011",,2011-10-17,"2011","10","17",9.14
"K22","C",13.76,7.85,0,1.06,2.28,5.09,"17/10/2011",,2011-10-17,"2011","10","17",5.91
"K22","D",22.29,7.85,0,0.13,1.22,13.88,"17/10/2011",,2011-10-17,"2011","10","17",14.44
"K26","A",13.79,7.85,0,0,0.09,5.39,"17/10/2011",,2011-10-17,"2011","10","17",5.94
"K26","B",13.57,7.85,0,0.09,0.34,6.05,"17/10/2011",,2011-10-17,"2011","10","17",5.72
"K26","C",10.2,7.85,0,0,0.07,2.52,"17/10/2011",,2011-10-17,"2011","10","17",2.35
"K26","D",13.99,7.85,0,0,0.14,6.61,"17/10/2011",,2011-10-17,"2011","10","17",6.14
"K27","A",9.03,7.85,0,0,0.48,1.16,"17/10/2011",,2011-10-17,"2011","10","17",1.18
"K27","B",17.68,7.85,0,2.25,0.19,7.57,"17/10/2011",,2011-10-17,"2011","10","17",9.83
"K27","C",15.55,7.85,0,3.09,2.37,2.62,"17/10/2011",,2011-10-17,"2011","10","17",7.7
"K27","D",13.85,7.85,1.39,0.44,1.3,2.42,"17/10/2011",,2011-10-17,"2011","10","17",6
"E21","A",13.05,7.68,0,0,0.36,5.46,"01/11/2011",,2011-11-01,"2011","11","01",5.37
"E21","B",25.9,7.68,0,11.79,0.97,7,"01/11/2011",,2011-11-01,"2011","11","01",18.22
"E21","C",17.62,7.68,0,0.07,2.35,8.2,"01/11/2011",,2011-11-01,"2011","11","01",9.94
"E21","D",16.95,7.68,0,0.5,4.97,4.74,"01/11/2011",,2011-11-01,"2011","11","01",9.27
"E22","A",8.61,7.68,0,0,0.27,0.91,"01/11/2011",,2011-11-01,"2011","11","01",0.93
"E22","B",19.79,7.68,6.28,0,1.48,5.6,"01/11/2011",,2011-11-01,"2011","11","01",12.11
"E22","C",15.8,7.68,0,0,0.38,8.82,"01/11/2011",,2011-11-01,"2011","11","01",8.12
"E22","D",28.68,7.68,0,0.11,18.35,3.34,"01/11/2011",,2011-11-01,"2011","11","01",21
"E26","A",13.18,7.68,1.15,0.4,0.61,3.9,"01/11/2011",,2011-11-01,"2011","11","01",5.5
"E26","B",17.99,7.68,0,0.35,0,3.75,"01/11/2011",,2011-11-01,"2011","11","01",10.31
"E26","C",9.1,7.68,0.79,0,0.06,0.65,"01/11/2011",,2011-11-01,"2011","11","01",1.42
"E26","D",15.61,7.68,0,1.32,1.65,5.83,"01/11/2011",,2011-11-01,"2011","11","01",7.93
"E27","A",12.35,7.68,0,0,0.73,4.31,"01/11/2011",,2011-11-01,"2011","11","01",4.67
"E27","B",15.07,7.68,0,2.13,3.38,2.47,"01/11/2011",,2011-11-01,"2011","11","01",7.39
"E27","C",13.96,7.68,0,0,0.31,6.7,"01/11/2011",,2011-11-01,"2011","11","01",6.28
"E27","D",22.23,7.68,0,1.17,3.9,10.76,"01/11/2011",,2011-11-01,"2011","11","01",14.55
"F21","A",15.39,7.68,0,1.4,0.68,6.06,"01/11/2011",,2011-11-01,"2011","11","01",7.71
"F21","B",26.08,7.68,0,1,1.99,16.65,"01/11/2011",,2011-11-01,"2011","11","01",18.4
"F21","C",14.5,7.68,0,1.65,1.62,4.22,"01/11/2011",,2011-11-01,"2011","11","01",6.82
"F21","D",16.87,7.68,0,1.21,1.04,7.97,"01/11/2011",,2011-11-01,"2011","11","01",9.19
"F22","A",22.27,7.68,0,0.88,2,12.37,"01/11/2011",,2011-11-01,"2011","11","01",14.59
"F22","B",14.73,7.68,0,0.35,1.33,6.18,"01/11/2011",,2011-11-01,"2011","11","01",7.05
"F22","C",16.73,7.68,0,1,1.13,7.44,"01/11/2011",,2011-11-01,"2011","11","01",9.05
"F22","D",19.4,7.68,0,0,0,12.76,"01/11/2011",,2011-11-01,"2011","11","01",11.72
"F26","A",12.18,7.68,0.08,0.05,0.45,5.33,"01/11/2011",,2011-11-01,"2011","11","01",4.5
"F26","B",11.05,7.68,0,0.49,0.22,2.31,"01/11/2011",,2011-11-01,"2011","11","01",3.37
"F26","C",16.11,7.68,2.5,0,2.4,3.18,"01/11/2011",,2011-11-01,"2011","11","01",8.43
"F26","D",10.82,7.68,0,0,1.3,2.12,"01/11/2011",,2011-11-01,"2011","11","01",3.14
"F27","A",16.67,7.68,0,0.49,1.48,7.79,"01/11/2011",,2011-11-01,"2011","11","01",8.99
"F27","B",14.4,7.68,0,0,2.43,5,"01/11/2011",,2011-11-01,"2011","11","01",6.72
"F27","C",11.84,7.68,0,0.12,0.62,3.88,"01/11/2011",,2011-11-01,"2011","11","01",4.16
"F27","D",12.84,7.68,0.34,0,1.6,3.79,"01/11/2011",,2011-11-01,"2011","11","01",5.16
"J21","A",14.24,7.68,0,0.33,0.12,6.52,"01/11/2011",,2011-11-01,"2011","11","01",6.56
"J21","B",12.18,7.68,0,1.15,1.77,2.06,"01/11/2011",,2011-11-01,"2011","11","01",4.5
"J21","C",12.99,7.68,0,0.41,0.13,5.21,"01/11/2011",,2011-11-01,"2011","11","01",5.31
"J21","D",18.62,7.68,0,0.28,2.26,8.71,"01/11/2011",,2011-11-01,"2011","11","01",10.94
"J22","A",16.75,7.68,0,1.11,0.32,8.55,"01/11/2011",,2011-11-01,"2011","11","01",9.07
"J22","B",11.22,7.68,0,0.13,0.28,3.47,"01/11/2011",,2011-11-01,"2011","11","01",3.54
"J22","C",15.96,7.68,0,1.95,1.34,6.36,"01/11/2011",,2011-11-01,"2011","11","01",8.28
"J22","D",22.7,7.68,0,12.49,1.12,2.67,"01/11/2011",,2011-11-01,"2011","11","01",15.02
"J26","A",18.38,7.68,0,0.14,1.36,10.22,"01/11/2011",,2011-11-01,"2011","11","01",10.7
"J26","B",15.71,7.68,0,0.65,1.09,7.49,"01/11/2011",,2011-11-01,"2011","11","01",8.03
"J26","C",10.16,7.68,0,0,0.21,3.1,"01/11/2011",,2011-11-01,"2011","11","01",2.48
"J26","D",22.12,7.68,0,0,2.13,13.72,"01/11/2011",,2011-11-01,"2011","11","01",14.44
"J27","A",13.35,7.68,0,0.03,0.96,5.4,"01/11/2011",,2011-11-01,"2011","11","01",5.67
"J27","B",12.52,7.68,0,0.17,0.44,4.69,"01/11/2011",,2011-11-01,"2011","11","01",4.84
"J27","C",12.73,7.68,0,0,0.27,5.28,"01/11/2011",,2011-11-01,"2011","11","01",5.05
"J27","D",15.68,7.68,0,0.05,0.3,8.44,"01/11/2011",,2011-11-01,"2011","11","01",8
"K21","A",15.52,7.68,2.5,0.98,0.81,4.18,"01/11/2011",,2011-11-01,"2011","11","01",7.84
"K21","B",15.23,7.68,0.73,0.7,1.2,5.56,"01/11/2011",,2011-11-01,"2011","11","01",7.55
"K21","C",15.32,7.68,0,1.88,0.85,5.47,"01/11/2011",,2011-11-01,"2011","11","01",7.64
"K21","D",15.91,7.68,0,0,0.35,8.3,"01/11/2011",,2011-11-01,"2011","11","01",8.23
"K22","A",13.22,7.68,0,0.6,1.17,4.39,"01/11/2011",,2011-11-01,"2011","11","01",5.54
"K22","B",13.12,7.68,0,0,0.28,5.6,"01/11/2011",,2011-11-01,"2011","11","01",5.44
"K22","C",14.35,7.68,1.13,0.05,0.68,5.2,"01/11/2011",,2011-11-01,"2011","11","01",6.67
"K22","D",11.56,7.68,0,0,0.47,3.7,"01/11/2011",,2011-11-01,"2011","11","01",3.88
"K26","A",11.9,7.68,0,0,0.49,4.07,"01/11/2011",,2011-11-01,"2011","11","01",4.22
"K26","B",13.01,7.68,0,0,0.14,5.62,"01/11/2011",,2011-11-01,"2011","11","01",5.33
"K26","C",23.49,7.68,0,0.38,2.33,14.73,"01/11/2011",,2011-11-01,"2011","11","01",15.81
"K26","D",13.54,7.68,0,0.19,0.03,6.17,"01/11/2011",,2011-11-01,"2011","11","01",5.86
"K27","A",10.74,7.68,0.34,0.52,1.19,1.29,"01/11/2011",,2011-11-01,"2011","11","01",3.06
"K27","B",12.7,7.68,0,0.96,0.36,3.22,"01/11/2011",,2011-11-01,"2011","11","01",5.02
"K27","C",13.68,7.68,0,4.99,0.92,0.89,"01/11/2011",,2011-11-01,"2011","11","01",6
"K27","D",12.67,7.68,0,0.99,0.81,3.08,"01/11/2011",,2011-11-01,"2011","11","01",4.99
"E21","A",13.1,7.97,0,0,22,5.06,"16/11/2011",,2011-11-16,"2011","11","16",5.13
"E21","B",20.82,7.97,5.88,3.51,0.46,3.3,"16/11/2011",,2011-11-16,"2011","11","16",12.85
"E21","C",14.79,7.97,0,1.89,0.57,4.64,"16/11/2011",,2011-11-16,"2011","11","16",6.82
"E21","D",12.85,7.97,0,0.46,1.95,2.65,"16/11/2011",,2011-11-16,"2011","11","16",4.88
"E22","A",15.76,7.97,0,0,0.08,2.21,"16/11/2011",,2011-11-16,"2011","11","16",7.79
"E22","B",13.69,7.97,3.37,0,0.68,1.93,"16/11/2011",,2011-11-16,"2011","11","16",5.72
"E22","C",15.9,7.97,0,0,0.67,7.55,"16/11/2011",,2011-11-16,"2011","11","16",7.93
"E22","D",25.79,7.97,0,0,13.49,4.59,"16/11/2011",,2011-11-16,"2011","11","16",17.82
"E26","A",21.95,7.97,10.71,0.03,0.28,3.15,"16/11/2011",,2011-11-16,"2011","11","16",13.98
"E26","B",14.55,7.97,0,2.33,0,4.3,"16/11/2011",,2011-11-16,"2011","11","16",6.58
"E26","C",10.5,7.97,0,0.42,0,2.15,"16/11/2011",,2011-11-16,"2011","11","16",2.53
"E26","D",11.52,7.97,0,0,0.56,4.56,"16/11/2011",,2011-11-16,"2011","11","16",3.55
"E27","A",11.76,7.97,0,0,0.66,3.21,"16/11/2011",,2011-11-16,"2011","11","16",3.79
"E27","B",13.77,7.97,0,4.96,0.2,0.8,"16/11/2011",,2011-11-16,"2011","11","16",5.8
"E27","C",14.2,7.97,0,0,0.1,6.42,"16/11/2011",,2011-11-16,"2011","11","16",6.23
"E27","D",11.34,7.97,0,0.62,0,2.9,"16/11/2011",,2011-11-16,"2011","11","16",3.37
"F21","A",17.49,7.97,0,3.65,0.07,6.04,"16/11/2011",,2011-11-16,"2011","11","16",9.52
"F21","B",18.93,7.97,0,0.97,0.3,9.63,"16/11/2011",,2011-11-16,"2011","11","16",10.96
"F21","C",9.85,7.97,0,0,0.03,1.85,"16/11/2011",,2011-11-16,"2011","11","16",1.88
"F21","D",40.94,7.97,0,0.08,2.22,30.87,"16/11/2011",,2011-11-16,"2011","11","16",32.97
"F22","A",10.18,7.97,0,0.06,0.08,7.72,"16/11/2011",,2011-11-16,"2011","11","16",2.21
"F22","B",16.58,7.97,0,0.51,0.13,7.71,"16/11/2011",,2011-11-16,"2011","11","16",8.61
"F22","C",37.71,7.97,0,15.65,2.2,11.81,"16/11/2011",,2011-11-16,"2011","11","16",29.74
"F22","D",12.69,7.97,0,0,0.04,4.62,"16/11/2011",,2011-11-16,"2011","11","16",4.72
"F26","A",14.85,7.97,1.76,0,0.57,4.57,"16/11/2011",,2011-11-16,"2011","11","16",6.88
"F26","B",14.64,7.97,0,5.23,0,1.44,"16/11/2011",,2011-11-16,"2011","11","16",6.67
"F26","C",12.82,7.97,0.66,0,0.26,3.87,"16/11/2011",,2011-11-16,"2011","11","16",4.85
"F26","D",9.84,7.97,0,0,0,9.84,"16/11/2011",,2011-11-16,"2011","11","16",1.87
"F27","A",13.36,7.97,0,0.02,0.25,5.25,"16/11/2011",,2011-11-16,"2011","11","16",5.39
"F27","B",15.23,7.97,0.08,0.02,3.23,3.98,"16/11/2011",,2011-11-16,"2011","11","16",7.26
"F27","C",19.79,7.97,1.14,0,0.1,10.6,"16/11/2011",,2011-11-16,"2011","11","16",11.82
"F27","D",14.36,7.97,3.38,0,0,3.12,"16/11/2011",,2011-11-16,"2011","11","16",6.39
"J21","A",20.6,7.97,0,0,0.2,12.53,"16/11/2011",,2011-11-16,"2011","11","16",12.63
"J21","B",9.58,7.97,0,0.3,0.21,1.47,"16/11/2011",,2011-11-16,"2011","11","16",1.61
"J21","C",12.66,7.97,0,0.63,0.49,3.64,"16/11/2011",,2011-11-16,"2011","11","16",4.69
"J21","D",30.92,7.97,0,0,10.81,12.42,"16/11/2011",,2011-11-16,"2011","11","16",22.95
"J22","A",13.49,7.97,0,0.88,0.26,4.53,"16/11/2011",,2011-11-16,"2011","11","16",5.52
"J22","B",10.38,7.97,0,0,0.09,2.4,"16/11/2011",,2011-11-16,"2011","11","16",2.41
"J22","C",10.25,7.97,0,0.27,0.86,1.26,"16/11/2011",,2011-11-16,"2011","11","16",2.28
"J22","D",20.77,7.97,0,10.36,0.21,2.44,"16/11/2011",,2011-11-16,"2011","11","16",12.8
"J26","A",11.93,7.97,0,0,0.08,3.91,"16/11/2011",,2011-11-16,"2011","11","16",3.96
"J26","B",12.5,7.97,0,0,0,12.5,"16/11/2011",,2011-11-16,"2011","11","16",4.53
"J26","C",12.46,7.97,0,0,0.4,4.26,"16/11/2011",,2011-11-16,"2011","11","16",4.49
"J26","D",15.44,7.97,0,0.08,0.31,7.09,"16/11/2011",,2011-11-16,"2011","11","16",7.47
"J27","A",12.11,7.97,0,0.09,0.73,3.45,"16/11/2011",,2011-11-16,"2011","11","16",4.14
"J27","B",10.89,7.97,0,0.28,0.1,2.57,"16/11/2011",,2011-11-16,"2011","11","16",2.92
"J27","C",12.09,7.97,0,0,0,12.09,"16/11/2011",,2011-11-16,"2011","11","16",4.12
"J27","D",14.92,7.97,0,0.1,0.17,6.8,"16/11/2011",,2011-11-16,"2011","11","16",6.95
"K21","A",13.8,7.97,0,1.01,0.15,4.74,"16/11/2011",,2011-11-16,"2011","11","16",5.83
"K21","B",20.73,7.97,0.28,1.28,2.04,9.18,"16/11/2011",,2011-11-16,"2011","11","16",12.76
"K21","C",18.74,7.97,0,4.26,3.93,2.7,"16/11/2011",,2011-11-16,"2011","11","16",10.77
"K21","D",19.46,7.97,0,0,2.01,9.55,"16/11/2011",,2011-11-16,"2011","11","16",11.49
"K22","A",12.99,7.97,0,0,0.58,3.58,"16/11/2011",,2011-11-16,"2011","11","16",5.02
"K22","B",12.48,7.97,0,0,0,12.48,"16/11/2011",,2011-11-16,"2011","11","16",4.51
"K22","C",13.64,7.97,0,0,0.25,5.62,"16/11/2011",,2011-11-16,"2011","11","16",5.67
"K22","D",12.31,7.97,0,0,0.05,4.43,"16/11/2011",,2011-11-16,"2011","11","16",4.34
"K26","A",11.26,7.97,0,0,0,11.26,"16/11/2011",,2011-11-16,"2011","11","16",3.29
"K26","B",9.96,7.97,0,0,0.05,2,"16/11/2011",,2011-11-16,"2011","11","16",1.99
"K26","C",9.14,7.97,0,0.17,0.11,1.06,"16/11/2011",,2011-11-16,"2011","11","16",1.17
"K26","D",10.04,7.97,0,0.26,0,1.95,"16/11/2011",,2011-11-16,"2011","11","16",2.07
"K27","A",9.86,7.97,0,0,0,9.86,"16/11/2011",,2011-11-16,"2011","11","16",1.89
"K27","B",11.97,7.97,0,0.12,0,3.77,"16/11/2011",,2011-11-16,"2011","11","16",4
"K27","C",14.95,7.97,0,5.39,0.14,1.52,"16/11/2011",,2011-11-16,"2011","11","16",6.98
"K27","D",12.55,7.97,0,1.23,0.12,3.3,"16/11/2011",,2011-11-16,"2011","11","16",4.58
"E21","A",13.04,7.66,0,0,0,13.04,"01/12/2011",,2011-12-01,"2011","12","01",5.38
"E21","B",29.54,7.66,7.06,4.06,1.17,10.52,"01/12/2011",,2011-12-01,"2011","12","01",21.88
"E21","C",14.3,7.66,0,3.3,1.03,2.89,"01/12/2011",,2011-12-01,"2011","12","01",6.64
"E21","D",11.97,7.66,0,0.26,0.39,3.99,"01/12/2011",,2011-12-01,"2011","12","01",4.31
"E22","A",14.07,7.66,0,0,0.15,6.65,"01/12/2011",,2011-12-01,"2011","12","01",6.41
"E22","B",14.53,7.66,4.14,0.25,0.37,2.69,"01/12/2011",,2011-12-01,"2011","12","01",6.87
"E22","C",26.17,7.66,0,0,4.15,14.95,"01/12/2011",,2011-12-01,"2011","12","01",18.51
"E22","D",12.79,7.66,0,0.18,0.75,4.22,"01/12/2011",,2011-12-01,"2011","12","01",5.13
"E26","A",23.57,7.66,13.03,0,1.43,2.07,"01/12/2011",,2011-12-01,"2011","12","01",15.91
"E26","B",13.42,7.66,0,0.38,0,5.81,"01/12/2011",,2011-12-01,"2011","12","01",5.76
"E26","C",10.93,7.66,0,2.69,0,0.92,"01/12/2011",,2011-12-01,"2011","12","01",3.27
"E26","D",21.58,7.66,0,0,10.01,3.81,"01/12/2011",,2011-12-01,"2011","12","01",13.92
"E27","A",9.52,7.66,0,0,0.14,1.98,"01/12/2011",,2011-12-01,"2011","12","01",1.86
"E27","B",12.06,7.66,0,0.39,0.23,4.14,"01/12/2011",,2011-12-01,"2011","12","01",4.4
"E27","C",15.73,7.66,0,0,0.59,7.79,"01/12/2011",,2011-12-01,"2011","12","01",8.07
"E27","D",12.11,7.66,0,0,1.26,3.46,"01/12/2011",,2011-12-01,"2011","12","01",4.45
"F21","A",14.84,7.66,0,0.71,0,6.85,"01/12/2011",,2011-12-01,"2011","12","01",7.18
"F21","B",24.36,7.66,0,0.86,3.96,15.89,"01/12/2011",,2011-12-01,"2011","12","01",16.7
"F21","C",9.44,7.66,0,0.35,0,1.69,"01/12/2011",,2011-12-01,"2011","12","01",1.78
"F21","D",35.37,7.66,0,0.62,0.44,27.71,"01/12/2011",,2011-12-01,"2011","12","01",27.71
"F22","A",13.63,7.66,0,0,0.34,5.94,"01/12/2011",,2011-12-01,"2011","12","01",5.97
"F22","B",16.98,7.66,0,0.61,0,9.1,"01/12/2011",,2011-12-01,"2011","12","01",9.32
"F22","C",13.69,7.66,3.12,0.28,0.19,2.91,"01/12/2011",,2011-12-01,"2011","12","01",6.03
"F22","D",12.28,7.66,0,0,0,12.28,"01/12/2011",,2011-12-01,"2011","12","01",4.62
"F26","A",10.03,7.66,0.13,0,0.17,2.43,"01/12/2011",,2011-12-01,"2011","12","01",2.37
"F26","B",10.09,7.66,0,1.02,0,1.7,"01/12/2011",,2011-12-01,"2011","12","01",2.43
"F26","C",11.48,7.66,1.15,0,0.21,2.8,"01/12/2011",,2011-12-01,"2011","12","01",3.82
"F26","D",9.46,7.66,0,0,0,9.46,"01/12/2011",,2011-12-01,"2011","12","01",1.8
"F27","A",14.46,7.66,0,0,0.78,6.86,"01/12/2011",,2011-12-01,"2011","12","01",6.8
"F27","B",12.79,7.66,0,0.39,0.45,4.7,"01/12/2011",,2011-12-01,"2011","12","01",5.13
"F27","C",30.85,7.66,4.61,0,1.44,17.16,"01/12/2011",,2011-12-01,"2011","12","01",23.19
"F27","D",17.99,7.66,6.93,0,0.48,2.56,"01/12/2011",,2011-12-01,"2011","12","01",10.33
"J21","A",13.27,7.66,0,0,0.71,5.16,"01/12/2011",,2011-12-01,"2011","12","01",5.61
"J21","B",13.99,7.66,0,0.51,0.95,5.17,"01/12/2011",,2011-12-01,"2011","12","01",6.33
"J21","C",12.78,7.66,0,0.08,1.24,4.25,"01/12/2011",,2011-12-01,"2011","12","01",5.12
"J21","D",19.92,7.66,0,0,2.41,10.08,"01/12/2011",,2011-12-01,"2011","12","01",12.26
"J22","A",19.47,7.66,0,0,0.96,5.43,"01/12/2011",,2011-12-01,"2011","12","01",11.81
"J22","B",12.37,7.66,0.33,0.09,0.24,4.17,"01/12/2011",,2011-12-01,"2011","12","01",4.71
"J22","C",13.34,7.66,0,0.52,0.62,4.82,"01/12/2011",,2011-12-01,"2011","12","01",5.68
"J22","D",38.81,7.66,0,23.98,3.85,4.14,"01/12/2011",,2011-12-01,"2011","12","01",31.15
"J26","A",13.25,7.66,0,0,1.18,4.77,"01/12/2011",,2011-12-01,"2011","12","01",5.59
"J26","B",11.64,7.66,0,0,0.37,3.57,"01/12/2011",,2011-12-01,"2011","12","01",3.98
"J26","C",11.63,7.66,0,0,0.29,3.92,"01/12/2011",,2011-12-01,"2011","12","01",3.97
"J26","D",25.05,7.66,0,0,2.62,15.24,"01/12/2011",,2011-12-01,"2011","12","01",17.39
"J27","A",12.08,7.66,0,0,0,12.08,"01/12/2011",,2011-12-01,"2011","12","01",4.42
"J27","B",10.05,7.66,0,0.24,0.12,2.52,"01/12/2011",,2011-12-01,"2011","12","01",2.39
"J27","C",12.83,7.66,0,0,0.14,5.33,"01/12/2011",,2011-12-01,"2011","12","01",5.17
"J27","D",11.61,7.66,0,0,0,3.95,"01/12/2011",,2011-12-01,"2011","12","01",3.95
"K21","A",14.62,7.66,0,0.51,0.68,6.12,"01/12/2011",,2011-12-01,"2011","12","01",6.96
"K21","B",29.75,7.66,0,4.03,8.49,10.07,"01/12/2011",,2011-12-01,"2011","12","01",22.09
"K21","C",17.59,7.66,0,5.84,2.31,2.38,"01/12/2011",,2011-12-01,"2011","12","01",9.93
"K21","D",13.71,7.66,0,0,0.1,6.33,"01/12/2011",,2011-12-01,"2011","12","01",6.05
"K22","A",15.79,7.66,0,0.16,0.44,7.8,"01/12/2011",,2011-12-01,"2011","12","01",8.13
"K22","B",15.29,7.66,0,0,0.92,7.19,"01/12/2011",,2011-12-01,"2011","12","01",7.63
"K22","C",13.42,7.66,0,0,0.63,8.43,"01/12/2011",,2011-12-01,"2011","12","01",5.76
"K22","D",10.83,7.66,0,0,0.4,3.05,"01/12/2011",,2011-12-01,"2011","12","01",3.17
"K26","A",11.37,7.66,0,0,0.42,3.6,"01/12/2011",,2011-12-01,"2011","12","01",3.71
"K26","B",12.93,7.66,0.21,0,0.42,5.14,"01/12/2011",,2011-12-01,"2011","12","01",5.27
"K26","C",12.83,7.66,0,0,0.13,4.36,"01/12/2011",,2011-12-01,"2011","12","01",5.17
"K26","D",13.06,7.66,0.13,1.45,0.17,3.93,"01/12/2011",,2011-12-01,"2011","12","01",5.4
"K27","A",10.93,7.66,0,0,0.17,3.3,"01/12/2011",,2011-12-01,"2011","12","01",3.27
"K27","B",12.74,7.66,1.48,0.54,0,3.45,"01/12/2011",,2011-12-01,"2011","12","01",5.08
"K27","C",9.47,7.66,0,0,0.28,1.67,"01/12/2011",,2011-12-01,"2011","12","01",1.81
"K27","D",20.31,7.66,0,9.09,1.08,2.92,"01/12/2011",,2011-12-01,"2011","12","01",12.65
"E21","A",9.53,7.57,0,0.44,0.17,1.53,"15/12/2011",,2011-12-15,"2011","12","15",1.96
"E21","B",16.1,7.57,0,0.53,1.49,7.3,"15/12/2011",,2011-12-15,"2011","12","15",8.53
"E21","C",27.04,7.57,0,16.87,2.35,1.83,"15/12/2011",,2011-12-15,"2011","12","15",19.47
"E21","D",17.06,7.57,0,0,0.23,3.56,"15/12/2011",,2011-12-15,"2011","12","15",9.49
"E22","A",12.28,7.57,0,0,0.78,4.44,"15/12/2011",,2011-12-15,"2011","12","15",4.71
"E22","B",13.37,7.57,3.9,0.18,1.02,1.22,"15/12/2011",,2011-12-15,"2011","12","15",5.8
"E22","C",26.32,7.57,0,0,4,15.95,"15/12/2011",,2011-12-15,"2011","12","15",18.75
"E22","D",14.24,7.57,0,0,3.73,3.42,"15/12/2011",,2011-12-15,"2011","12","15",6.67
"E26","A",9.01,7.57,0,0,0,9.01,"15/12/2011",,2011-12-15,"2011","12","15",1.44
"E26","B",11.26,7.57,0,0,3.44,0.42,"15/12/2011",,2011-12-15,"2011","12","15",3.69
"E26","C",9.72,7.57,0,0.21,0,2.24,"15/12/2011",,2011-12-15,"2011","12","15",2.15
"E26","D",10.92,7.57,0,0.08,1.42,2.31,"15/12/2011",,2011-12-15,"2011","12","15",3.35
"E27","A",8.37,7.57,0,0,0.19,0.62,"15/12/2011",,2011-12-15,"2011","12","15",0.799999999999999
"E27","B",9.1,7.57,0,0.03,0.08,1.46,"15/12/2011",,2011-12-15,"2011","12","15",1.53
"E27","C",11.15,7.57,0.7,0,0.15,3.08,"15/12/2011",,2011-12-15,"2011","12","15",3.58
"E27","D",13.2,7.57,0,1.47,1.6,2.75,"15/12/2011",,2011-12-15,"2011","12","15",5.63
"F21","A",10.08,7.57,0,0,0,10.08,"15/12/2011",,2011-12-15,"2011","12","15",2.51
"F21","B",18.12,7.57,0,0.13,3.69,7.37,"15/12/2011",,2011-12-15,"2011","12","15",10.55
"F21","C",10.45,7.57,0,0.55,0.1,2.65,"15/12/2011",,2011-12-15,"2011","12","15",2.88
"F21","D",9.46,7.57,0,0,0,9.46,"15/12/2011",,2011-12-15,"2011","12","15",1.89
"F22","A",12.59,7.57,0,0,0.37,5.07,"15/12/2011",,2011-12-15,"2011","12","15",5.02
"F22","B",23.47,7.57,0,0,12.22,4.88,"15/12/2011",,2011-12-15,"2011","12","15",15.9
"F22","C",9.17,7.57,0,0,0.26,1.41,"15/12/2011",,2011-12-15,"2011","12","15",1.6
"F22","D",9.48,7.57,0,0,0.17,1.86,"15/12/2011",,2011-12-15,"2011","12","15",1.91
"F26","A",9.81,7.57,0,0,0,9.81,"15/12/2011",,2011-12-15,"2011","12","15",2.24
"F26","B",11.56,7.57,0,0,0,11.56,"15/12/2011",,2011-12-15,"2011","12","15",3.99
"F26","C",10.83,7.57,0.95,0,0.23,2.42,"15/12/2011",,2011-12-15,"2011","12","15",3.26
"F26","D",9.88,7.57,0.52,0,0.14,1.88,"15/12/2011",,2011-12-15,"2011","12","15",2.31
"F27","A",11,7.57,0,0,0.16,3.6,"15/12/2011",,2011-12-15,"2011","12","15",3.43
"F27","B",15.18,7.57,0,0.17,3.17,4.93,"15/12/2011",,2011-12-15,"2011","12","15",7.61
"F27","C",11.98,7.57,0,0,0.86,3.99,"15/12/2011",,2011-12-15,"2011","12","15",4.41
"F27","D",8.89,7.57,0,0,0,8.89,"15/12/2011",,2011-12-15,"2011","12","15",1.32
"J21","A",12.1,7.57,0,0,4.87,0.32,"15/12/2011",,2011-12-15,"2011","12","15",4.53
"J21","B",12.32,7.57,0,0.1,0.79,4.07,"15/12/2011",,2011-12-15,"2011","12","15",4.75
"J21","C",64.9,7.57,0,10.53,2.69,46.72,"15/12/2011",,2011-12-15,"2011","12","15",57.33
"J21","D",16.68,7.57,0,0.28,5.24,4.41,"15/12/2011",,2011-12-15,"2011","12","15",9.11
"J22","A",17.59,7.57,0,7.57,0.69,2.61,"15/12/2011",,2011-12-15,"2011","12","15",10.02
"J22","B",9.3,7.57,0,0,1.26,0.89,"15/12/2011",,2011-12-15,"2011","12","15",1.73
"J22","C",12.48,7.57,0.69,1.35,1.02,2.16,"15/12/2011",,2011-12-15,"2011","12","15",4.91
"J22","D",33.86,7.57,0,26.26,0.49,0.23,"15/12/2011",,2011-12-15,"2011","12","15",26.29
"J26","A",10.47,7.57,0.4,0,0.21,2.76,"15/12/2011",,2011-12-15,"2011","12","15",2.9
"J26","B",8.82,7.57,0,0,0,8.82,"15/12/2011",,2011-12-15,"2011","12","15",1.25
"J26","C",10.04,7.57,0,0,0.21,3.68,"15/12/2011",,2011-12-15,"2011","12","15",2.47
"J26","D",13.4,7.57,0.39,0,1.74,4.27,"15/12/2011",,2011-12-15,"2011","12","15",5.83
"J27","A",11.89,7.57,0,0,0.28,4.48,"15/12/2011",,2011-12-15,"2011","12","15",4.32
"J27","B",8.7,7.57,0,0,0,8.7,"15/12/2011",,2011-12-15,"2011","12","15",1.13
"J27","C",8.89,7.57,0,0,0,8.89,"15/12/2011",,2011-12-15,"2011","12","15",1.32
"J27","D",10.01,7.57,0,0,0.38,2.48,"15/12/2011",,2011-12-15,"2011","12","15",2.44
"K21","A",10.56,7.57,0,0.64,0.92,1.62,"15/12/2011",,2011-12-15,"2011","12","15",2.99
"K21","B",13.65,7.57,0,1.35,0.16,4.74,"15/12/2011",,2011-12-15,"2011","12","15",6.08
"K21","C",11.19,7.57,0,2.23,0.55,1.28,"15/12/2011",,2011-12-15,"2011","12","15",3.62
"K21","D",14.27,7.57,0,0,1.16,6.15,"15/12/2011",,2011-12-15,"2011","12","15",6.7
"K22","A",11.9,7.57,0,0.79,2.06,1.88,"15/12/2011",,2011-12-15,"2011","12","15",4.33
"K22","B",10.96,7.57,0,0,1.31,2.29,"15/12/2011",,2011-12-15,"2011","12","15",3.39
"K22","C",11.18,7.57,0,0,0.34,3.42,"15/12/2011",,2011-12-15,"2011","12","15",3.61
"K22","D",8.26,7.57,0,0,0,8.16,"15/12/2011",,2011-12-15,"2011","12","15",0.69
"K26","A",10.15,7.57,0,0,0,10.5,"15/12/2011",,2011-12-15,"2011","12","15",2.58
"K26","B",12.19,7.57,0,0.69,0.54,3.93,"15/12/2011",,2011-12-15,"2011","12","15",4.62
"K26","C",18.96,7.57,0,0.18,0.37,11.43,"15/12/2011",,2011-12-15,"2011","12","15",11.39
"K26","D",9.57,7.57,0,,0.16,1.95,"15/12/2011",,2011-12-15,"2011","12","15",2
"K27","A",11.41,7.57,0,1.27,0.3,2.47,"15/12/2011",,2011-12-15,"2011","12","15",3.84
"K27","B",8.29,7.57,0,0,0,8.29,"15/12/2011",,2011-12-15,"2011","12","15",0.719999999999999
"K27","C",9.31,7.57,0,1.16,0,0.78,"15/12/2011",,2011-12-15,"2011","12","15",1.74
"K27","D",38.16,7.57,0,27.67,3.08,2.08,"15/12/2011",,2011-12-15,"2011","12","15",30.59
"E21","A",12.98,7.55,0,0,0.23,4.14,"02/01/2012",,2012-01-02,"2012","01","02",5.43
"E21","B",15.61,7.55,1.58,3.4,0.03,3.05,"02/01/2012",,2012-01-02,"2012","01","02",8.06
"E21","C",66.38,7.55,0,51.04,5.75,3.04,"02/01/2012",,2012-01-02,"2012","01","02",58.83
"E21","D",13.62,7.55,0.53,0,0.16,5.45,"02/01/2012",,2012-01-02,"2012","01","02",6.07
"E22","A",15.22,7.55,0,0.87,0,7.09,"02/01/2012",,2012-01-02,"2012","01","02",7.67
"E22","B",18.09,7.55,1.26,0,4.43,5.14,"02/01/2012",,2012-01-02,"2012","01","02",10.54
"E22","C",15.61,7.55,1.43,0,0.8,8.74,"02/01/2012",,2012-01-02,"2012","01","02",8.06
"E22","D",18.15,7.55,0,0,5.54,5.2,"02/01/2012",,2012-01-02,"2012","01","02",10.6
"E26","A",11.1,7.55,0,0.08,1.15,2.35,"02/01/2012",,2012-01-02,"2012","01","02",3.55
"E26","B",17.69,7.55,0,3.56,0,6.74,"02/01/2012",,2012-01-02,"2012","01","02",10.14
"E26","C",11.39,7.55,0,0,0,11.39,"02/01/2012",,2012-01-02,"2012","01","02",3.84
"E26","D",12.45,7.55,0,0.36,1.08,3.49,"02/01/2012",,2012-01-02,"2012","01","02",4.9
"E27","A",10.58,7.55,0,0.2,0.7,2.15,"02/01/2012",,2012-01-02,"2012","01","02",3.03
"E27","B",10.82,7.55,0,0,0.66,2.55,"02/01/2012",,2012-01-02,"2012","01","02",3.27
"E27","C",12.93,7.55,0.8,3.76,0.12,0.52,"02/01/2012",,2012-01-02,"2012","01","02",5.38
"E27","D",35.12,7.55,5.48,7.98,6.82,8.31,"02/01/2012",,2012-01-02,"2012","01","02",27.57
"F21","A",16.57,7.55,0,3.08,0.03,6.03,"02/01/2012",,2012-01-02,"2012","01","02",9.02
"F21","B",42.07,7.55,0,37.56,0.07,3.91,"02/01/2012",,2012-01-02,"2012","01","02",34.52
"F21","C",56.65,7.55,0.38,16.11,0.42,17.56,"02/01/2012",,2012-01-02,"2012","01","02",49.1
"F21","D",20.56,7.55,0,1.58,0.76,10.88,"02/01/2012",,2012-01-02,"2012","01","02",13.01
"F22","A",19.96,7.55,0,5.56,0.39,6.71,"02/01/2012",,2012-01-02,"2012","01","02",12.41
"F22","B",16.23,7.55,0,0,3.76,5.04,"02/01/2012",,2012-01-02,"2012","01","02",8.68
"F22","C",10.36,7.55,0,0,0.26,2.2,"02/01/2012",,2012-01-02,"2012","01","02",2.81
"F22","D",13.65,7.55,0,0,0,13.15,"02/01/2012",,2012-01-02,"2012","01","02",6.1
"F26","A",12.13,7.55,0,0.42,0.57,3.43,"02/01/2012",,2012-01-02,"2012","01","02",4.58
"F26","B",15.03,7.55,0,0.21,0.06,7.41,"02/01/2012",,2012-01-02,"2012","01","02",7.48
"F26","C",17.38,7.55,0,0,0,17.38,"02/01/2012",,2012-01-02,"2012","01","02",9.83
"F26","D",12.88,7.55,0,0.19,0.36,4.57,"02/01/2012",,2012-01-02,"2012","01","02",5.33
"F27","A",19.5,7.55,0,2.57,0.4,9.23,"02/01/2012",,2012-01-02,"2012","01","02",11.95
"F27","B",21.74,7.55,0,6.36,3.93,4.11,"02/01/2012",,2012-01-02,"2012","01","02",14.19
"F27","C",28.74,7.55,0,0,0,28.47,"02/01/2012",,2012-01-02,"2012","01","02",21.19
"F27","D",10.81,7.55,0,0,0.18,3.07,"02/01/2012",,2012-01-02,"2012","01","02",3.26
"J21","A",12.27,7.55,0,0,0.83,3.65,"02/01/2012",,2012-01-02,"2012","01","02",4.72
"J21","B",11.86,7.55,0,0.42,0.37,3.57,"02/01/2012",,2012-01-02,"2012","01","02",4.31
"J21","C",11.38,7.55,2.04,0,0,2.1,"02/01/2012",,2012-01-02,"2012","01","02",3.83
"J21","D",16.12,6.36,3.98,0,0.53,5.82,"02/01/2012",,2012-01-02,"2012","01","02",9.76
"J22","A",15.13,6.36,2.16,1.1,1.15,5,"02/01/2012",,2012-01-02,"2012","01","02",8.77
"J22","B",15.17,6.36,4.03,0,1.59,3.64,"02/01/2012",,2012-01-02,"2012","01","02",8.81
"J22","C",19.38,7.55,1.83,5.64,1.82,2.86,"02/01/2012",,2012-01-02,"2012","01","02",11.83
"J22","D",15.87,7.55,0,5.98,0.26,1.97,"02/01/2012",,2012-01-02,"2012","01","02",8.32
"J26","A",13.03,7.55,1.8,0,0.3,3.18,"02/01/2012",,2012-01-02,"2012","01","02",5.48
"J26","B",13.98,6.36,0,0,0.12,7.82,"02/01/2012",,2012-01-02,"2012","01","02",7.62
"J26","C",11.63,7.55,0,0,0.29,6.64,"02/01/2012",,2012-01-02,"2012","01","02",4.08
"J26","D",15.65,6.36,2.5,0,0.93,6.35,"02/01/2012",,2012-01-02,"2012","01","02",9.29
"J27","A",11.95,7.55,0,0.59,0.55,3.3,"02/01/2012",,2012-01-02,"2012","01","02",4.4
"J27","B",12.49,7.55,1.02,0.13,0.13,3.53,"02/01/2012",,2012-01-02,"2012","01","02",4.94
"J27","C",10.85,7.55,0,0,0.47,2.84,"02/01/2012",,2012-01-02,"2012","01","02",3.3
"J27","D",10.11,7.55,0.28,0,0,2.1,"02/01/2012",,2012-01-02,"2012","01","02",2.56
"K21","A",12.77,7.55,0,0,0.32,5.08,"02/01/2012",,2012-01-02,"2012","01","02",5.22
"K21","B",17.8,7.55,0,2.62,0.07,7.73,"02/01/2012",,2012-01-02,"2012","01","02",10.25
"K21","C",20.38,7.55,0,9.63,0.71,1.95,"02/01/2012",,2012-01-02,"2012","01","02",12.83
"K21","D",12.79,6.36,0,0,0,12.79,"02/01/2012",,2012-01-02,"2012","01","02",6.43
"K22","A",13.86,7.55,0,0,0.86,5.47,"02/01/2012",,2012-01-02,"2012","01","02",6.31
"K22","B",11.16,6.36,0,1.72,0.33,2.36,"02/01/2012",,2012-01-02,"2012","01","02",4.8
"K22","C",15.06,6.36,0,0,3.54,6.71,"02/01/2012",,2012-01-02,"2012","01","02",8.7
"K22","D",11.6,7.55,0,0,0.62,3.53,"02/01/2012",,2012-01-02,"2012","01","02",4.05
"K26","A",10.76,7.55,0.49,0,0,2.76,"02/01/2012",,2012-01-02,"2012","01","02",3.21
"K26","B",15.6,7.55,0,0.07,0.87,7.34,"02/01/2012",,2012-01-02,"2012","01","02",8.05
"K26","C",23.1,6.36,0,0,2.86,14.5,"02/01/2012",,2012-01-02,"2012","01","02",16.74
"K26","D",15.06,7.55,0,0.22,0.29,7.06,"02/01/2012",,2012-01-02,"2012","01","02",7.51
"K27","A",11.69,7.55,0,0.08,0.14,3.8,"02/01/2012",,2012-01-02,"2012","01","02",4.14
"K27","B",11.8,6.36,1.31,0,0.98,3.54,"02/01/2012",,2012-01-02,"2012","01","02",5.44
"K27","C",11.09,7.55,0,0.09,0.36,2.81,"02/01/2012",,2012-01-02,"2012","01","02",3.54
"K27","D",30.8,7.55,0,17.02,3.18,3.98,"02/01/2012",,2012-01-02,"2012","01","02",23.25
"E21","A",15.65,6.5,0,3.64,0.82,4.36,"16/01/2012",,2012-01-16,"2012","01","16",9.15
"E21","B",14.4,6.5,0,0,0.25,2.22,"16/01/2012",,2012-01-16,"2012","01","16",7.9
"E21","C",20.84,6.5,0,5.52,3.51,5.2,"16/01/2012",,2012-01-16,"2012","01","16",14.34
"E21","D",8.09,4.78,0.35,5.76,0.33,1.82,"16/01/2012",,2012-01-16,"2012","01","16",3.31
"E22","A",9.16,4.78,0,0.8,0.4,3.95,"16/01/2012",,2012-01-16,"2012","01","16",4.38
"E22","B",15.06,6.5,2.19,0,0.3,6.26,"16/01/2012",,2012-01-16,"2012","01","16",8.56
"E22","C",19.59,6.5,0,0,0,19.59,"16/01/2012",,2012-01-16,"2012","01","16",13.09
"E22","D",12.74,4.78,0,0,4.91,3.18,"16/01/2012",,2012-01-16,"2012","01","16",7.96
"E26","A",6.73,4.78,0,0.24,0.52,1.27,"16/01/2012",,2012-01-16,"2012","01","16",1.95
"E26","B",6.41,4.78,0,0.02,0.14,1.46,"16/01/2012",,2012-01-16,"2012","01","16",1.63
"E26","C",8.92,4.78,0,1.59,1.4,1.15,"16/01/2012",,2012-01-16,"2012","01","16",4.14
"E26","D",25.9,6.5,4.35,10.7,1.86,3.13,"16/01/2012",,2012-01-16,"2012","01","16",19.4
"E27","A",5.92,4.78,0,0,0.58,0.51,"16/01/2012",,2012-01-16,"2012","01","16",1.14
"E27","B",7.11,4.78,0,0,0.08,2.19,"16/01/2012",,2012-01-16,"2012","01","16",2.33
"E27","C",6.1,4.78,0,0.42,0,0.74,"16/01/2012",,2012-01-16,"2012","01","16",1.32
"E27","D",8.52,4.78,0,0.16,1.92,1.73,"16/01/2012",,2012-01-16,"2012","01","16",3.74
"F21","A",19.62,6.5,0,8.6,1.18,3.98,"16/01/2012",,2012-01-16,"2012","01","16",13.12
"F21","B",18.94,6.5,2.49,0.2,1.5,8.2,"16/01/2012",,2012-01-16,"2012","01","16",12.44
"F21","C",57.65,4.78,0,36.17,2,17.02,"16/01/2012",,2012-01-16,"2012","01","16",52.87
"F21","D",19.33,6.5,0,5.68,0.58,6.54,"16/01/2012",,2012-01-16,"2012","01","16",12.83
"F22","A",21.99,6.5,0,5.05,2.63,4.18,"16/01/2012",,2012-01-16,"2012","01","16",15.49
"F22","B",14.75,4.78,0,0.26,1.44,8.44,"16/01/2012",,2012-01-16,"2012","01","16",9.97
"F22","C",6.13,4.78,0,0,0.14,1.13,"16/01/2012",,2012-01-16,"2012","01","16",1.35
"F22","D",10.95,4.78,0,0,0.71,3.51,"16/01/2012",,2012-01-16,"2012","01","16",6.17
"F26","A",7.74,4.78,0,0,0.58,2.43,"16/01/2012",,2012-01-16,"2012","01","16",2.96
"F26","B",6.32,4.78,0,0.13,0,1.44,"16/01/2012",,2012-01-16,"2012","01","16",1.54
"F26","C",9.54,4.78,0.89,0,0.9,3.12,"16/01/2012",,2012-01-16,"2012","01","16",4.76
"F26","D",7.33,4.78,0,0,0.42,2.2,"16/01/2012",,2012-01-16,"2012","01","16",2.55
"F27","A",14.3,4.78,0,2.71,0.64,5.27,"16/01/2012",,2012-01-16,"2012","01","16",9.52
"F27","B",10.44,4.78,0,1.76,1.52,2.01,"16/01/2012",,2012-01-16,"2012","01","16",5.66
"F27","C",8.78,4.78,1.97,0,0,2.22,"16/01/2012",,2012-01-16,"2012","01","16",4
"F27","D",7.23,4.78,0,0,0.48,2.03,"16/01/2012",,2012-01-16,"2012","01","16",2.45
"J21","A",8.82,4.78,0,1.18,0.44,2.43,"16/01/2012",,2012-01-16,"2012","01","16",4.04
"J21","B",6.08,4.78,0,0,0.11,1.14,"16/01/2012",,2012-01-16,"2012","01","16",1.3
"J21","C",14.03,4.78,0,0.92,0.59,4.23,"16/01/2012",,2012-01-16,"2012","01","16",9.25
"J21","D",9.01,4.78,1.29,0,0.98,2.24,"16/01/2012",,2012-01-16,"2012","01","16",4.23
"J22","A",8.1,4.78,1.11,0,0.11,2.1,"16/01/2012",,2012-01-16,"2012","01","16",3.32
"J22","B",9.14,4.78,0.12,0.06,0.83,3.5,"16/01/2012",,2012-01-16,"2012","01","16",4.36
"J22","C",15.8,4.78,1.34,9.12,0.45,0.76,"16/01/2012",,2012-01-16,"2012","01","16",11.02
"J22","D",6.26,4.78,0,0,0.42,1.13,"16/01/2012",,2012-01-16,"2012","01","16",1.48
"J26","A",10.29,4.78,0.81,0,0.51,4.12,"16/01/2012",,2012-01-16,"2012","01","16",5.51
"J26","B",9.31,4.78,0,0.73,0,3.91,"16/01/2012",,2012-01-16,"2012","01","16",4.53
"J26","C",9.09,4.78,0,0.14,0.12,4.02,"16/01/2012",,2012-01-16,"2012","01","16",4.31
"J26","D",11.63,4.78,1.06,0,0.2,5.67,"16/01/2012",,2012-01-16,"2012","01","16",6.85
"J27","A",8.41,4.78,0,0.76,0,2.76,"16/01/2012",,2012-01-16,"2012","01","16",3.63
"J27","B",9.47,4.78,0,0,0.25,4.45,"16/01/2012",,2012-01-16,"2012","01","16",4.69
"J27","C",6.19,4.78,0,0.02,0.1,1.3,"16/01/2012",,2012-01-16,"2012","01","16",1.41
"J27","D",6.27,4.78,0,0,0,6.27,"16/01/2012",,2012-01-16,"2012","01","16",1.49
"K21","A",6.54,4.78,0,0,0.02,1.58,"16/01/2012",,2012-01-16,"2012","01","16",1.76
"K21","B",10.07,4.78,0,0,0.27,5.03,"16/01/2012",,2012-01-16,"2012","01","16",5.29
"K21","C",17.06,6.5,0,8.67,0.46,1.9,"16/01/2012",,2012-01-16,"2012","01","16",10.56
"K21","D",10.02,4.78,0,0,0,10.02,"16/01/2012",,2012-01-16,"2012","01","16",5.24
"K22","A",6.72,4.78,0,0.87,0.18,0.84,"16/01/2012",,2012-01-16,"2012","01","16",1.94
"K22","B",10.03,4.78,0,4.57,0.45,0.36,"16/01/2012",,2012-01-16,"2012","01","16",5.25
"K22","C",7.39,4.78,0,0,0.31,2.31,"16/01/2012",,2012-01-16,"2012","01","16",2.61
"K22","D",6.38,4.78,0,0,0.27,1.26,"16/01/2012",,2012-01-16,"2012","01","16",1.6
"K26","A",7.36,4.78,1.2,0,0.45,0.88,"16/01/2012",,2012-01-16,"2012","01","16",2.58
"K26","B",12.16,4.78,0,3.45,0.02,4.15,"16/01/2012",,2012-01-16,"2012","01","16",7.38
"K26","C",7.79,4.78,0,0.18,0,2.8,"16/01/2012",,2012-01-16,"2012","01","16",3.01
"K26","D",7.25,4.78,0,0,0,7.25,"16/01/2012",,2012-01-16,"2012","01","16",2.47
"K27","A",7.57,4.78,0,0.47,0.52,1.77,"16/01/2012",,2012-01-16,"2012","01","16",2.79
"K27","B",6.7,4.78,0,0,0.21,16,"16/01/2012",,2012-01-16,"2012","01","16",1.92
"K27","C",8.08,4.78,0,1.1,1.67,0.43,"16/01/2012",,2012-01-16,"2012","01","16",3.3
"K27","D",13.04,4.78,0,5.1,2.82,0.54,"16/01/2012",,2012-01-16,"2012","01","16",8.26
"E21","A",23.62,4.69,0,11.14,0.46,8.31,"01/02/2012",,2012-02-01,"2012","02","01",18.93
"E21","B",6.62,4.69,0,0.16,0.46,1.28,"01/02/2012",,2012-02-01,"2012","02","01",1.93
"E21","C",9.05,4.69,0,1.45,0.99,1.98,"01/02/2012",,2012-02-01,"2012","02","01",4.36
"E21","D",10.03,4.69,0,0.95,0.53,4,"01/02/2012",,2012-02-01,"2012","02","01",5.34
"E22","A",11.26,4.69,0,0,0,11.26,"01/02/2012",,2012-02-01,"2012","02","01",6.57
"E22","B",14.44,4.69,0,0.04,7.3,2.65,"01/02/2012",,2012-02-01,"2012","02","01",9.75
"E22","C",15.47,4.69,0,0,0,15.47,"01/02/2012",,2012-02-01,"2012","02","01",10.78
"E22","D",16.25,4.69,0,0,5.07,6.65,"01/02/2012",,2012-02-01,"2012","02","01",11.56
"E26","A",9.94,4.69,0,0,0.62,4.65,"01/02/2012",,2012-02-01,"2012","02","01",5.25
"E26","B",6.53,4.69,0,0,0,6.53,"01/02/2012",,2012-02-01,"2012","02","01",1.84
"E26","C",6.19,4.69,0,0.04,0,1.48,"01/02/2012",,2012-02-01,"2012","02","01",1.5
"E26","D",7.68,4.69,0,0.04,0.21,2.83,"01/02/2012",,2012-02-01,"2012","02","01",2.99
"E27","A",6.08,4.69,0,0.31,0.02,0.94,"01/02/2012",,2012-02-01,"2012","02","01",1.39
"E27","B",6.3,4.69,0,0,0,6.3,"01/02/2012",,2012-02-01,"2012","02","01",1.61
"E27","C",7.01,4.69,0,0,0.25,2.11,"01/02/2012",,2012-02-01,"2012","02","01",2.32
"E27","D",29.08,4.69,0,17.63,5.29,2.74,"01/02/2012",,2012-02-01,"2012","02","01",24.39
"F21","A",17.25,4.69,0,4.75,1.12,7.08,"01/02/2012",,2012-02-01,"2012","02","01",12.56
"F21","B",10.85,4.69,0,1.91,0.49,3.95,"01/02/2012",,2012-02-01,"2012","02","01",6.16
"F21","C",18.58,4.69,0,8.07,1.94,4.38,"01/02/2012",,2012-02-01,"2012","02","01",13.89
"F21","D",18.66,4.69,0,8.53,2.57,3.46,"01/02/2012",,2012-02-01,"2012","02","01",13.97
"F22","A",13.64,4.69,0,0.71,1.53,6.89,"01/02/2012",,2012-02-01,"2012","02","01",8.95
"F22","B",22.27,4.69,0,0,2.35,15.52,"01/02/2012",,2012-02-01,"2012","02","01",17.58
"F22","C",5.77,4.69,0,0,0,5.77,"01/02/2012",,2012-02-01,"2012","02","01",1.08
"F22","D",16.38,4.69,0,2.34,0.16,9.44,"01/02/2012",,2012-02-01,"2012","02","01",11.69
"F26","A",9.08,4.69,0,0,0,9.08,"01/02/2012",,2012-02-01,"2012","02","01",4.39
"F26","B",7.64,4.69,0,0,0,7.64,"01/02/2012",,2012-02-01,"2012","02","01",2.95
"F26","C",9.28,4.69,0,0.06,0.41,3.97,"01/02/2012",,2012-02-01,"2012","02","01",4.59
"F26","D",5.9,4.69,0,0.06,0.2,1.02,"01/02/2012",,2012-02-01,"2012","02","01",1.21
"F27","A",9.13,4.69,0,0.87,0.14,3.28,"01/02/2012",,2012-02-01,"2012","02","01",4.44
"F27","B",14.94,4.69,0,1.18,3.45,5.92,"01/02/2012",,2012-02-01,"2012","02","01",10.25
"F27","C",7.2,4.69,0,0.17,0.19,2.14,"01/02/2012",,2012-02-01,"2012","02","01",2.51
"F27","D",6.65,4.69,0,0,0.32,1.62,"01/02/2012",,2012-02-01,"2012","02","01",1.96
"J21","A",9.2,4.69,0,1.68,1.31,1.67,"01/02/2012",,2012-02-01,"2012","02","01",4.51
"J21","B",7.78,4.69,0,0.15,0.56,2.4,"01/02/2012",,2012-02-01,"2012","02","01",3.09
"J21","C",12.73,4.69,0,0.66,2.53,3.95,"01/02/2012",,2012-02-01,"2012","02","01",8.04
"J21","D",12.33,4.69,0,0,0.33,7.37,"01/02/2012",,2012-02-01,"2012","02","01",7.64
"J22","A",12.47,4.69,0,0,2.43,5.45,"01/02/2012",,2012-02-01,"2012","02","01",7.78
"J22","B",12.05,4.69,0,0,0.78,6.6,"01/02/2012",,2012-02-01,"2012","02","01",7.36
"J22","C",18.25,4.69,0,6.1,3.89,4.01,"01/02/2012",,2012-02-01,"2012","02","01",13.56
"J22","D",7.24,4.69,0,0,0.4,2.15,"01/02/2012",,2012-02-01,"2012","02","01",2.55
"J26","A",7.66,4.69,0,0.02,0,2.93,"01/02/2012",,2012-02-01,"2012","02","01",2.97
"J26","B",9.94,4.69,0,0.43,0.09,3.49,"01/02/2012",,2012-02-01,"2012","02","01",5.25
"J26","C",10.98,4.69,0,0.64,3.47,2.33,"01/02/2012",,2012-02-01,"2012","02","01",6.29
"J26","D",12.62,4.69,0,0,2.23,5.71,"01/02/2012",,2012-02-01,"2012","02","01",7.93
"J27","A",13.28,4.69,0,3.76,1.52,3.55,"01/02/2012",,2012-02-01,"2012","02","01",8.59
"J27","B",6.27,4.69,0,0,0,6.27,"01/02/2012",,2012-02-01,"2012","02","01",1.58
"J27","C",9.1,4.69,0,0,0.2,4.35,"01/02/2012",,2012-02-01,"2012","02","01",4.41
"J27","D",7.96,4.69,0,0,0.27,2.98,"01/02/2012",,2012-02-01,"2012","02","01",3.27
"K21","A",10.96,4.69,0,0,1.43,5.03,"01/02/2012",,2012-02-01,"2012","02","01",6.27
"K21","B",6.87,4.69,0,0,1.05,1.1,"01/02/2012",,2012-02-01,"2012","02","01",2.18
"K21","C",11.22,4.69,0,2.12,0.64,3.99,"01/02/2012",,2012-02-01,"2012","02","01",6.53
"K21","D",13.07,4.69,0,0,2.94,5.57,"01/02/2012",,2012-02-01,"2012","02","01",8.38
"K22","A",12.75,4.69,0,5.07,1.49,1.87,"01/02/2012",,2012-02-01,"2012","02","01",8.06
"K22","B",11.43,4.69,0,3.47,1.79,1.65,"01/02/2012",,2012-02-01,"2012","02","01",6.74
"K22","C",11.62,4.69,0,0,0.34,6.73,"01/02/2012",,2012-02-01,"2012","02","01",6.93
"K22","D",7.1,4.69,0,0,0,7.1,"01/02/2012",,2012-02-01,"2012","02","01",2.41
"K26","A",23.85,4.69,0,0,0.55,18.89,"01/02/2012",,2012-02-01,"2012","02","01",19.16
"K26","B",10.52,4.69,0,0.26,1.19,4.39,"01/02/2012",,2012-02-01,"2012","02","01",5.83
"K26","C",14.59,4.69,0,5.32,0.52,3.99,"01/02/2012",,2012-02-01,"2012","02","01",9.9
"K26","D",7.7,4.69,0,0,0.11,2.78,"01/02/2012",,2012-02-01,"2012","02","01",3.01
"K27","A",15.18,4.69,0,6.48,0.63,3.62,"01/02/2012",,2012-02-01,"2012","02","01",10.49
"K27","B",10.15,4.69,0,0.69,0,4.72,"01/02/2012",,2012-02-01,"2012","02","01",5.46
"K27","C",7.97,4.69,0,0,0.4,2.86,"01/02/2012",,2012-02-01,"2012","02","01",3.28
"K27","D",11.85,4.69,0,2.52,1.88,2.95,"01/02/2012",,2012-02-01,"2012","02","01",7.16
"E21","A",16.7,5.64,0,1.99,2.66,6.73,"15/02/2012",,2012-02-15,"2012","02","15",11.06
"E21","B",10.95,5.64,0,0,2.52,3.16,"15/02/2012",,2012-02-15,"2012","02","15",5.31
"E21","C",12.15,5.64,0,1.07,2.38,3.28,"15/02/2012",,2012-02-15,"2012","02","15",6.51
"E21","D",0,0,0,0,0,0,"15/02/2012",,2012-02-15,"2012","02","15",0
"E22","A",12.53,5.64,2.56,0,0,4.67,"15/02/2012",,2012-02-15,"2012","02","15",6.89
"E22","B",11.33,5.64,0,0,1.63,4.32,"15/02/2012",,2012-02-15,"2012","02","15",5.69
"E22","C",12.47,5.64,0,0,0.56,6.56,"15/02/2012",,2012-02-15,"2012","02","15",6.83
"E22","D",21.47,5.64,0,0.31,10.21,5.85,"15/02/2012",,2012-02-15,"2012","02","15",15.83
"E26","A",10.61,5.64,0,0,3.29,1.98,"15/02/2012",,2012-02-15,"2012","02","15",4.97
"E26","B",12.72,5.64,0,0,3.22,4.19,"15/02/2012",,2012-02-15,"2012","02","15",7.08
"E26","C",13.37,5.64,0,0,0.28,4.56,"15/02/2012",,2012-02-15,"2012","02","15",7.73
"E26","D",13.24,5.64,0,0.22,4.26,3.48,"15/02/2012",,2012-02-15,"2012","02","15",7.6
"E27","A",10.84,5.64,0,0.81,3.2,1.33,"15/02/2012",,2012-02-15,"2012","02","15",5.2
"E27","B",9.39,5.64,0,0,0.5,4.05,"15/02/2012",,2012-02-15,"2012","02","15",3.75
"E27","C",7.49,5.64,0,0.43,0.2,1.24,"15/02/2012",,2012-02-15,"2012","02","15",1.85
"E27","D",21.64,5.64,0,3.15,8.06,5.46,"15/02/2012",,2012-02-15,"2012","02","15",16
"F21","A",13.94,5.64,0,1.03,2.63,4.96,"15/02/2012",,2012-02-15,"2012","02","15",8.3
"F21","B",14.84,5.64,0,0.93,2.77,5.31,"15/02/2012",,2012-02-15,"2012","02","15",9.2
"F21","C",15.12,5.64,0,0,4.29,5.38,"15/02/2012",,2012-02-15,"2012","02","15",9.48
"F21","D",28.04,5.64,0,0,5.66,7.42,"15/02/2012",,2012-02-15,"2012","02","15",22.4
"F22","A",21.66,5.64,0,0,1.64,15.03,"15/02/2012",,2012-02-15,"2012","02","15",16.02
"F22","B",18.06,5.64,0,0,1.5,11.24,"15/02/2012",,2012-02-15,"2012","02","15",12.42
"F22","C",9.71,5.64,0,0,2.8,1.42,"15/02/2012",,2012-02-15,"2012","02","15",4.07
"F22","D",18.27,5.64,0,0.33,1.03,11.64,"15/02/2012",,2012-02-15,"2012","02","15",12.63
"F26","A",11.51,5.64,0,0,0.69,5.38,"15/02/2012",,2012-02-15,"2012","02","15",5.87
"F26","B",0,0,0,0,0,0,"15/02/2012",,2012-02-15,"2012","02","15",0
"F26","C",13.31,5.64,0,0,2.71,5.32,"15/02/2012",,2012-02-15,"2012","02","15",7.67
"F26","D",9.11,5.64,0,0,2.66,0.94,"15/02/2012",,2012-02-15,"2012","02","15",3.47
"F27","A",13.58,5.64,0,0,1.72,6.57,"15/02/2012",,2012-02-15,"2012","02","15",7.94
"F27","B",15.75,5.64,0,0.77,3.94,5.79,"15/02/2012",,2012-02-15,"2012","02","15",10.11
"F27","C",8,5.64,0,0.4,0.38,1.66,"15/02/2012",,2012-02-15,"2012","02","15",2.36
"F27","D",12.2,5.64,0.48,0,3.97,2.38,"15/02/2012",,2012-02-15,"2012","02","15",6.56
"J21","A",11.15,5.64,0,0,1.16,4.6,"15/02/2012",,2012-02-15,"2012","02","15",5.51
"J21","B",0,0,0,0,0,0,"15/02/2012",,2012-02-15,"2012","02","15",0
"J21","C",13.08,5.64,4.17,0,0.68,2.42,"15/02/2012",,2012-02-15,"2012","02","15",7.44
"J21","D",14.56,5.64,0,0,1.28,7.91,"15/02/2012",,2012-02-15,"2012","02","15",8.92
"J22","A",13.39,5.64,0,0,1.82,6.14,"15/02/2012",,2012-02-15,"2012","02","15",7.75
"J22","B",9.79,5.64,0,0,0.36,3.76,"15/02/2012",,2012-02-15,"2012","02","15",4.15
"J22","C",12.84,5.64,0,1.2,2.45,3.62,"15/02/2012",,2012-02-15,"2012","02","15",7.2
"J22","D",8.49,5.64,0,0,0.59,2.23,"15/02/2012",,2012-02-15,"2012","02","15",2.85
"J26","A",0,0,0,0,0,0,"15/02/2012",,2012-02-15,"2012","02","15",0
"J26","B",0,0,0,0,0,0,"15/02/2012",,2012-02-15,"2012","02","15",0
"J26","C",21.67,5.64,6.45,0.71,0.29,8.85,"15/02/2012",,2012-02-15,"2012","02","15",16.03
"J26","D",10.74,5.64,0,0,0.3,4.94,"15/02/2012",,2012-02-15,"2012","02","15",5.1
"J27","A",12.93,5.64,0,0,2.05,5.46,"15/02/2012",,2012-02-15,"2012","02","15",7.29
"J27","B",8.35,5.64,0.4,0,1.29,1.1,"15/02/2012",,2012-02-15,"2012","02","15",2.71
"J27","C",9.88,5.64,0,0,0.28,4.28,"15/02/2012",,2012-02-15,"2012","02","15",4.24
"J27","D",0,0,0,0,0,0,"15/02/2012",,2012-02-15,"2012","02","15",0
"K21","A",9.74,5.64,0,0,1.99,2.39,"15/02/2012",,2012-02-15,"2012","02","15",4.1
"K21","B",0,0,0,0,0,0,"15/02/2012",,2012-02-15,"2012","02","15",0
"K21","C",11.33,5.64,0,0.78,1.56,3.54,"15/02/2012",,2012-02-15,"2012","02","15",5.69
"K21","D",0,0,0,0,0,0,"15/02/2012",,2012-02-15,"2012","02","15",0
"K22","A",12.23,5.64,0,0,2.79,4.02,"15/02/2012",,2012-02-15,"2012","02","15",6.59
"K22","B",0,0,0,0,0,0,"15/02/2012",,2012-02-15,"2012","02","15",0
"K22","C",9.47,5.64,0,0,0,9.47,"15/02/2012",,2012-02-15,"2012","02","15",3.83
"K22","D",15.73,5.64,0,0,1.83,8.16,"15/02/2012",,2012-02-15,"2012","02","15",10.09
"K26","A",0,0,0,0,0,0,"15/02/2012",,2012-02-15,"2012","02","15",0
"K26","B",0,0,0,0,0,0,"15/02/2012",,2012-02-15,"2012","02","15",0
"K26","C",14.46,5.64,0,4.38,0.62,3.78,"15/02/2012",,2012-02-15,"2012","02","15",8.82
"K26","D",8.56,5.64,0,0,0,8.56,"15/02/2012",,2012-02-15,"2012","02","15",2.92
"K27","A",12.93,5.64,0,3.88,1.11,2.47,"15/02/2012",,2012-02-15,"2012","02","15",7.29
"K27","B",0,0,0,0,0,0,"15/02/2012",,2012-02-15,"2012","02","15",0
"K27","C",8.85,5.64,0,0,0.28,3.26,"15/02/2012",,2012-02-15,"2012","02","15",3.21
"K27","D",11.51,5.64,0,2.86,2.16,1.18,"15/02/2012",,2012-02-15,"2012","02","15",5.87
"E21","A",7.7,4.62,0,0,0.37,2.81,"01/03/2012",,2012-03-01,"2012","03","01",3.08
"E21","B",8.91,4.62,0,0,0.77,3.74,"01/03/2012",,2012-03-01,"2012","03","01",4.29
"E21","C",7.58,4.62,0,0.92,0.67,1.66,"01/03/2012",,2012-03-01,"2012","03","01",2.96
"E21","D",7.45,4.62,0,0,0.17,2.86,"01/03/2012",,2012-03-01,"2012","03","01",2.83
"E22","A",9.51,4.62,0,0,0.97,4.24,"01/03/2012",,2012-03-01,"2012","03","01",4.89
"E22","B",13.93,4.62,0,0,4.18,5.24,"01/03/2012",,2012-03-01,"2012","03","01",9.31
"E22","C",19.44,4.62,0,0,0.6,15,"01/03/2012",,2012-03-01,"2012","03","01",14.82
"E22","D",9.64,4.62,0,0,2.18,3.06,"01/03/2012",,2012-03-01,"2012","03","01",5.02
"E26","A",8.68,4.62,0,0,0.85,2.51,"01/03/2012",,2012-03-01,"2012","03","01",4.06
"E26","B",9.42,5.53,0,0,1.06,3,"01/03/2012",,2012-03-01,"2012","03","01",3.89
"E26","C",6.97,5.53,0,0.07,0.05,1.33,"01/03/2012",,2012-03-01,"2012","03","01",1.44
"E26","D",11.38,5.53,0,0.13,0.36,5.52,"01/03/2012",,2012-03-01,"2012","03","01",5.85
"E27","A",9.41,4.62,0,0.86,0.48,2.63,"01/03/2012",,2012-03-01,"2012","03","01",4.79
"E27","B",9.42,5.53,0,0,0.16,3.97,"01/03/2012",,2012-03-01,"2012","03","01",3.89
"E27","C",23.29,5.53,0,17.14,0.76,0.76,"01/03/2012",,2012-03-01,"2012","03","01",17.76
"E27","D",14.2,5.53,0,0,1.23,7.87,"01/03/2012",,2012-03-01,"2012","03","01",8.67
"F21","A",8.74,4.62,0,0.2,1.93,2.28,"01/03/2012",,2012-03-01,"2012","03","01",4.12
"F21","B",10.95,4.62,0,0,0,10.95,"01/03/2012",,2012-03-01,"2012","03","01",6.33
"F21","C",9.61,4.62,0,0,1.34,3.83,"01/03/2012",,2012-03-01,"2012","03","01",4.99
"F21","D",24.83,4.62,0,0,6.28,8.43,"01/03/2012",,2012-03-01,"2012","03","01",20.21
"F22","A",12.18,5.53,0,0,0.17,7.09,"01/03/2012",,2012-03-01,"2012","03","01",6.65
"F22","B",17.45,5.53,0,0.15,1.15,11.53,"01/03/2012",,2012-03-01,"2012","03","01",11.92
"F22","C",7.04,5.53,0,0,0.17,1.69,"01/03/2012",,2012-03-01,"2012","03","01",1.51
"F22","D",16.53,5.53,0,0,0.83,10.84,"01/03/2012",,2012-03-01,"2012","03","01",11
"F26","A",7.64,5.53,0,0,0,7.64,"01/03/2012",,2012-03-01,"2012","03","01",2.11
"F26","B",9.71,5.53,0,0.49,0.39,3.68,"01/03/2012",,2012-03-01,"2012","03","01",4.18
"F26","C",14.99,5.53,0,1.34,1.38,7.48,"01/03/2012",,2012-03-01,"2012","03","01",9.46
"F26","D",8.98,5.53,0,0.15,0.3,3.42,"01/03/2012",,2012-03-01,"2012","03","01",3.45
"F27","A",12.56,5.53,0,0,0.27,7.33,"01/03/2012",,2012-03-01,"2012","03","01",7.03
"F27","B",20.82,5.53,0,0,8.25,7.92,"01/03/2012",,2012-03-01,"2012","03","01",15.29
"F27","C",7.85,5.53,0,0.18,0.26,2.31,"01/03/2012",,2012-03-01,"2012","03","01",2.32
"F27","D",8.27,5.53,1.48,0,0.58,1.18,"01/03/2012",,2012-03-01,"2012","03","01",2.74
"J21","A",10.9,4.62,0,0,1.57,5.24,"01/03/2012",,2012-03-01,"2012","03","01",6.28
"J21","B",14.4,4.62,0,0,2.92,7.4,"01/03/2012",,2012-03-01,"2012","03","01",9.78
"J21","C",9.7,4.62,1.3,0.13,0.68,3.31,"01/03/2012",,2012-03-01,"2012","03","01",5.08
"J21","D",14.15,4.62,0,0,3.18,6.9,"01/03/2012",,2012-03-01,"2012","03","01",9.53
"J22","A",11.08,4.62,0,0,1.76,5.19,"01/03/2012",,2012-03-01,"2012","03","01",6.46
"J22","B",11.15,4.62,0,0,0.64,6.24,"01/03/2012",,2012-03-01,"2012","03","01",6.53
"J22","C",18.35,4.62,0,0,6.24,8.33,"01/03/2012",,2012-03-01,"2012","03","01",13.73
"J22","D",10.12,4.62,0,0,1.89,3.9,"01/03/2012",,2012-03-01,"2012","03","01",5.5
"J26","A",11.66,5.53,0,0.07,0,6.42,"01/03/2012",,2012-03-01,"2012","03","01",6.13
"J26","B",19.36,5.53,0,0.1,0.92,13.66,"01/03/2012",,2012-03-01,"2012","03","01",13.83
"J26","C",18.11,5.53,6.21,0.6,0.79,5.69,"01/03/2012",,2012-03-01,"2012","03","01",12.58
"J26","D",11.95,5.53,0,0,0.63,6.23,"01/03/2012",,2012-03-01,"2012","03","01",6.42
"J27","A",9.07,5.53,0,0,0.49,3.38,"01/03/2012",,2012-03-01,"2012","03","01",3.54
"J27","B",8.3,4.62,0,0,0.95,3.02,"01/03/2012",,2012-03-01,"2012","03","01",3.68
"J27","C",10.9,4.62,0,0,2,4.79,"01/03/2012",,2012-03-01,"2012","03","01",6.28
"J27","D",6.06,4.62,0,0.09,0.18,1.21,"01/03/2012",,2012-03-01,"2012","03","01",1.44
"K21","A",10.61,4.62,0,0.14,2.73,3.46,"01/03/2012",,2012-03-01,"2012","03","01",5.99
"K21","B",7.57,4.62,0,0,0.52,2.63,"01/03/2012",,2012-03-01,"2012","03","01",2.95
"K21","C",8.52,4.62,0,0,1,3.17,"01/03/2012",,2012-03-01,"2012","03","01",3.9
"K21","D",8.55,4.62,0,0,0.22,3.91,"01/03/2012",,2012-03-01,"2012","03","01",3.93
"K22","A",12.81,4.62,0,2.79,0.37,5.51,"01/03/2012",,2012-03-01,"2012","03","01",8.19
"K22","B",10.46,4.62,0,0,0.3,5.92,"01/03/2012",,2012-03-01,"2012","03","01",5.84
"K22","C",9.63,4.62,0,0,1.37,3.96,"01/03/2012",,2012-03-01,"2012","03","01",5.01
"K22","D",9.32,4.62,0,0,1.02,3.96,"01/03/2012",,2012-03-01,"2012","03","01",4.7
"K26","A",12.48,4.62,0,0,0.19,7.05,"01/03/2012",,2012-03-01,"2012","03","01",7.86
"K26","B",11.38,4.62,0,0,2.51,3.65,"01/03/2012",,2012-03-01,"2012","03","01",6.76
"K26","C",9.09,5.53,0,0.36,0.53,2.81,"01/03/2012",,2012-03-01,"2012","03","01",3.56
"K26","D",7.01,5.53,0.03,0,0.21,1.22,"01/03/2012",,2012-03-01,"2012","03","01",1.48
"K27","A",10.71,4.62,0,3.68,0.47,2.4,"01/03/2012",,2012-03-01,"2012","03","01",6.09
"K27","B",7.95,4.62,0,0,0.14,3.38,"01/03/2012",,2012-03-01,"2012","03","01",3.33
"K27","C",6.13,4.62,0,0,0,6.13,"01/03/2012",,2012-03-01,"2012","03","01",1.51
"K27","D",5.81,4.62,0,0,0.52,0.81,"01/03/2012",,2012-03-01,"2012","03","01",1.19
"E21","A",18.68,4.73,0,0,6.25,8.34,"15/03/2012",,2012-03-15,"2012","03","15",13.95
"E21","B",10.14,4.73,0,0,7.79,2.92,"15/03/2012",,2012-03-15,"2012","03","15",5.41
"E21","C",12.07,4.73,0,0,3.18,4.59,"15/03/2012",,2012-03-15,"2012","03","15",7.34
"E21","D",12.44,4.73,0,0,2.48,5.47,"15/03/2012",,2012-03-15,"2012","03","15",7.71
"E22","A",11.9,4.73,0,0,1.67,5.82,"15/03/2012",,2012-03-15,"2012","03","15",7.17
"E22","B",14.89,4.73,0,0,2.84,7.71,"15/03/2012",,2012-03-15,"2012","03","15",10.16
"E22","C",12.54,4.73,0,0,0.48,7.61,"15/03/2012",,2012-03-15,"2012","03","15",7.81
"E22","D",20.74,4.73,0,0,9.64,6.87,"15/03/2012",,2012-03-15,"2012","03","15",16.01
"E26","A",11.62,4.73,0,0,2.05,5.13,"15/03/2012",,2012-03-15,"2012","03","15",6.89
"E26","B",23.31,4.73,0,0,9.26,10,"15/03/2012",,2012-03-15,"2012","03","15",18.58
"E26","C",10.07,4.73,0,0.55,2.68,2.48,"15/03/2012",,2012-03-15,"2012","03","15",5.34
"E26","D",16.76,4.73,0,0.16,4.75,7.57,"15/03/2012",,2012-03-15,"2012","03","15",12.03
"E27","A",9.94,4.73,0,2.06,0.66,2.92,"15/03/2012",,2012-03-15,"2012","03","15",5.21
"E27","B",9,4.73,0,0,2.25,2.27,"15/03/2012",,2012-03-15,"2012","03","15",4.27
"E27","C",9.03,4.73,0,0,2.8,1.72,"15/03/2012",,2012-03-15,"2012","03","15",4.3
"E27","D",17.61,4.73,0,0,4.26,9.22,"15/03/2012",,2012-03-15,"2012","03","15",12.88
"F21","A",11.96,4.73,0,0,2.07,5.48,"15/03/2012",,2012-03-15,"2012","03","15",7.23
"F21","B",15.25,4.73,0,1.04,3.31,6.67,"15/03/2012",,2012-03-15,"2012","03","15",10.52
"F21","C",7.69,4.73,0,0,0.36,2.69,"15/03/2012",,2012-03-15,"2012","03","15",2.96
"F21","D",16.5,4.73,0,0,4.81,7.21,"15/03/2012",,2012-03-15,"2012","03","15",11.77
"F22","A",23.13,4.73,0,0,5.03,14.04,"15/03/2012",,2012-03-15,"2012","03","15",18.4
"F22","B",19.1,4.73,0,0,5.61,9.32,"15/03/2012",,2012-03-15,"2012","03","15",14.37
"F22","C",10.94,4.73,0,0.12,3,3.31,"15/03/2012",,2012-03-15,"2012","03","15",6.21
"F22","D",16.16,4.73,0,0,2.1,9.59,"15/03/2012",,2012-03-15,"2012","03","15",11.43
"F26","A",11.9,4.73,0,0,1.02,6.49,"15/03/2012",,2012-03-15,"2012","03","15",7.17
"F26","B",9.46,4.73,0,0.84,0.68,3.48,"15/03/2012",,2012-03-15,"2012","03","15",4.73
"F26","C",17.66,4.73,0,0.38,5.27,7.62,"15/03/2012",,2012-03-15,"2012","03","15",12.93
"F26","D",9.76,4.73,0,0.12,0.24,4.81,"15/03/2012",,2012-03-15,"2012","03","15",5.03
"F27","A",13.73,4.73,0,0.19,4.23,7.98,"15/03/2012",,2012-03-15,"2012","03","15",9
"F27","B",18.11,4.73,0,1.2,8.82,3.71,"15/03/2012",,2012-03-15,"2012","03","15",13.38
"F27","C",11.03,4.73,0,0.56,3.71,2.19,"15/03/2012",,2012-03-15,"2012","03","15",6.3
"F27","D",11.52,4.73,0,0,3.76,3.25,"15/03/2012",,2012-03-15,"2012","03","15",6.79
"J21","A",16.03,4.73,0,1.2,3.74,6.92,"15/03/2012",,2012-03-15,"2012","03","15",11.3
"J21","B",9.43,4.73,0,0.16,1.39,3.31,"15/03/2012",,2012-03-15,"2012","03","15",4.7
"J21","C",9.7,4.73,0,0,0.94,4.17,"15/03/2012",,2012-03-15,"2012","03","15",4.97
"J21","D",15.13,4.73,0,0,3.33,7.66,"15/03/2012",,2012-03-15,"2012","03","15",10.4
"J22","A",16.29,4.73,0,0,2.22,9.79,"15/03/2012",,2012-03-15,"2012","03","15",11.56
"J22","B",17.57,4.73,0,0,0.89,12.5,"15/03/2012",,2012-03-15,"2012","03","15",12.84
"J22","C",11.39,4.73,0,0,1.84,5.26,"15/03/2012",,2012-03-15,"2012","03","15",6.66
"J22","D",9.95,4.73,0,0,2.02,3.37,"15/03/2012",,2012-03-15,"2012","03","15",5.22
"J26","A",12.6,4.73,0,0.36,2.88,5.1,"15/03/2012",,2012-03-15,"2012","03","15",7.87
"J26","B",17.56,4.73,0,0.16,1.04,12.18,"15/03/2012",,2012-03-15,"2012","03","15",12.83
"J26","C",16.82,4.73,0,1.93,3.27,7.4,"15/03/2012",,2012-03-15,"2012","03","15",12.09
"J26","D",13.31,4.73,0,0,0.84,7.96,"15/03/2012",,2012-03-15,"2012","03","15",8.58
"J27","A",9.42,4.73,0,0,0.5,4.43,"15/03/2012",,2012-03-15,"2012","03","15",4.69
"J27","B",31.1,4.73,0,0.92,4,22.36,"15/03/2012",,2012-03-15,"2012","03","15",26.37
"J27","C",13.84,4.73,0,0.1,3.4,6.04,"15/03/2012",,2012-03-15,"2012","03","15",9.11
"J27","D",11.71,4.73,0,1.43,2.02,3.81,"15/03/2012",,2012-03-15,"2012","03","15",6.98
"K21","A",14.2,4.73,0,0,6.19,3.75,"15/03/2012",,2012-03-15,"2012","03","15",9.47
"K21","B",12.5,4.73,0,0,5.24,2.77,"15/03/2012",,2012-03-15,"2012","03","15",7.77
"K21","C",11.47,4.73,0,0.67,3.94,2.74,"15/03/2012",,2012-03-15,"2012","03","15",6.74
"K21","D",10.02,4.73,0,0,3.38,2.21,"15/03/2012",,2012-03-15,"2012","03","15",5.29
"K22","A",19.37,4.73,0,3.35,4.24,7.85,"15/03/2012",,2012-03-15,"2012","03","15",14.64
"K22","B",11.76,4.73,0,0,1.38,6.12,"15/03/2012",,2012-03-15,"2012","03","15",7.03
"K22","C",18.3,4.73,0,0.07,4.72,9.45,"15/03/2012",,2012-03-15,"2012","03","15",13.57
"K22","D",13.2,4.73,0,0,3.38,5.57,"15/03/2012",,2012-03-15,"2012","03","15",8.47
"K26","A",10.01,4.73,0,0,2.22,3.25,"15/03/2012",,2012-03-15,"2012","03","15",5.28
"K26","B",17.73,4.73,0,1.29,5.47,6.93,"15/03/2012",,2012-03-15,"2012","03","15",13
"K26","C",19.58,4.73,0,0.09,5.4,9.95,"15/03/2012",,2012-03-15,"2012","03","15",14.85
"K26","D",8.86,4.73,0,0,1,3.4,"15/03/2012",,2012-03-15,"2012","03","15",4.13
"K27","A",16.05,4.73,0,3.75,1.98,5.95,"15/03/2012",,2012-03-15,"2012","03","15",11.32
"K27","B",10.53,4.73,0,0.12,0.8,5.13,"15/03/2012",,2012-03-15,"2012","03","15",5.8
"K27","C",7.75,4.73,0,0,2.33,0.91,"15/03/2012",,2012-03-15,"2012","03","15",3.02
"K27","D",9.01,4.73,0,0,1.69,2.82,"15/03/2012",,2012-03-15,"2012","03","15",4.28
"E21","A",9.99,5.43,0,0,0,9.99,"02/04/2012",,2012-04-02,"2012","04","02",4.56
"E21","B",9.96,5.43,0,0,0.32,4.25,"02/04/2012",,2012-04-02,"2012","04","02",4.53
"E21","C",17.89,5.43,0,0,0,17.89,"02/04/2012",,2012-04-02,"2012","04","02",12.46
"E21","D",19.02,5.43,0,0.26,4.36,9.31,"02/04/2012",,2012-04-02,"2012","04","02",13.59
"E22","A",34.06,4.62,8.79,0,0,21.25,"02/04/2012",,2012-04-02,"2012","04","02",29.44
"E22","B",9.89,5.43,0,0,0.63,3.96,"02/04/2012",,2012-04-02,"2012","04","02",4.46
"E22","C",7.86,5.43,0,0,0,7.86,"02/04/2012",,2012-04-02,"2012","04","02",2.43
"E22","D",10.25,5.43,0,0,0.29,4.86,"02/04/2012",,2012-04-02,"2012","04","02",4.82
"E26","A",13.34,5.43,0,0,1.47,6.78,"02/04/2012",,2012-04-02,"2012","04","02",7.91
"E26","B",13.12,5.43,0,0,0.48,7.2,"02/04/2012",,2012-04-02,"2012","04","02",7.69
"E26","C",17.1,5.43,0,9.24,0.05,2.75,"02/04/2012",,2012-04-02,"2012","04","02",11.67
"E26","D",16.64,5.43,0,1.75,1.75,8.12,"02/04/2012",,2012-04-02,"2012","04","02",11.21
"E27","A",14.72,5.43,0,6,0.38,3.25,"02/04/2012",,2012-04-02,"2012","04","02",9.29
"E27","B",14.86,5.43,0,0.14,0,9.78,"02/04/2012",,2012-04-02,"2012","04","02",9.43
"E27","C",10.33,5.43,0,0.43,0,4.76,"02/04/2012",,2012-04-02,"2012","04","02",4.9
"E27","D",14.56,5.43,0,0,0.06,9.01,"02/04/2012",,2012-04-02,"2012","04","02",9.13
"F21","A",16.2,5.43,0,0,1.42,10.03,"02/04/2012",,2012-04-02,"2012","04","02",10.77
"F21","B",20.13,5.43,0,0,1.26,14.18,"02/04/2012",,2012-04-02,"2012","04","02",14.7
"F21","C",8.66,5.43,0,0.69,0.16,2.61,"02/04/2012",,2012-04-02,"2012","04","02",3.23
"F21","D",15.64,5.43,0,0,0,15.68,"02/04/2012",,2012-04-02,"2012","04","02",10.21
"F22","A",17.69,5.43,0,0,0,17.96,"02/04/2012",,2012-04-02,"2012","04","02",12.26
"F22","B",16,5.43,0,0,0.22,10.64,"02/04/2012",,2012-04-02,"2012","04","02",10.57
"F22","C",9.46,5.43,0,0.83,0,3.54,"02/04/2012",,2012-04-02,"2012","04","02",4.03
"F22","D",11.62,5.43,0,0,0.75,5.55,"02/04/2012",,2012-04-02,"2012","04","02",6.19
"F26","A",14.89,5.43,0,0,0.21,9.48,"02/04/2012",,2012-04-02,"2012","04","02",9.46
"F26","B",10.28,5.43,0,0.82,0.22,4.15,"02/04/2012",,2012-04-02,"2012","04","02",4.85
"F26","C",18.89,5.43,0,0,0.94,13.12,"02/04/2012",,2012-04-02,"2012","04","02",13.46
"F26","D",12.2,5.43,0,0,0.72,6.48,"02/04/2012",,2012-04-02,"2012","04","02",6.77
"F27","A",16.48,5.43,0,0,0.6,10.88,"02/04/2012",,2012-04-02,"2012","04","02",11.05
"F27","B",16.09,5.43,0,0,0.53,10.38,"02/04/2012",,2012-04-02,"2012","04","02",10.66
"F27","C",10.8,5.43,0,1.39,0,4.32,"02/04/2012",,2012-04-02,"2012","04","02",5.37
"F27","D",9.1,5.43,0,0.35,0.52,2.99,"02/04/2012",,2012-04-02,"2012","04","02",3.67
"J21","A",11.39,5.43,0,0,0,11.39,"02/04/2012",,2012-04-02,"2012","04","02",5.96
"J21","B",16.24,5.43,0,0.32,0.82,10.44,"02/04/2012",,2012-04-02,"2012","04","02",10.81
"J21","C",12.09,5.43,0,0,2.18,5.09,"02/04/2012",,2012-04-02,"2012","04","02",6.66
"J21","D",25.04,5.43,0,0,9.8,11.44,"02/04/2012",,2012-04-02,"2012","04","02",19.61
"J22","A",11.87,5.43,0,0,0.5,6.38,"02/04/2012",,2012-04-02,"2012","04","02",6.44
"J22","B",12.09,5.43,0,0,1.7,5.3,"02/04/2012",,2012-04-02,"2012","04","02",6.66
"J22","C",10.6,5.43,0,0.16,0.5,4.85,"02/04/2012",,2012-04-02,"2012","04","02",5.17
"J22","D",7.73,5.43,0,0,0.16,2.06,"02/04/2012",,2012-04-02,"2012","04","02",2.3
"J26","A",19.6,5.43,0,0.82,0.92,12.78,"02/04/2012",,2012-04-02,"2012","04","02",14.17
"J26","B",21.42,5.43,0,0.32,0.36,16.03,"02/04/2012",,2012-04-02,"2012","04","02",15.99
"J26","C",20.2,5.43,0,4.54,1.1,9.68,"02/04/2012",,2012-04-02,"2012","04","02",14.77
"J26","D",16.82,5.43,0,0,0.55,11.29,"02/04/2012",,2012-04-02,"2012","04","02",11.39
"J27","A",13.3,5.43,0,0,0.08,8.05,"02/04/2012",,2012-04-02,"2012","04","02",7.87
"J27","B",10.62,5.43,0,0,0.48,5.08,"02/04/2012",,2012-04-02,"2012","04","02",5.19
"J27","C",12.52,5.43,0,0,2.09,5.59,"02/04/2012",,2012-04-02,"2012","04","02",7.09
"J27","D",12.35,5.43,0,0.36,1.19,5.93,"02/04/2012",,2012-04-02,"2012","04","02",6.92
"K21","A",13.07,5.43,0,2,2.2,6.09,"02/04/2012",,2012-04-02,"2012","04","02",7.64
"K21","B",11.83,5.43,0,0,0.37,6.73,"02/04/2012",,2012-04-02,"2012","04","02",6.4
"K21","C",13.28,5.43,0,0,0.47,6.13,"02/04/2012",,2012-04-02,"2012","04","02",7.85
"K21","D",11.62,5.43,0,0,0.28,6.53,"02/04/2012",,2012-04-02,"2012","04","02",6.19
"K22","A",19.98,5.43,0,0,0.91,13.46,"02/04/2012",,2012-04-02,"2012","04","02",14.55
"K22","B",15.58,5.43,0,0,0.28,10.58,"02/04/2012",,2012-04-02,"2012","04","02",10.15
"K22","C",13.09,5.43,0,0.26,0.71,7.23,"02/04/2012",,2012-04-02,"2012","04","02",7.66
"K22","D",11.22,5.43,0,0,0.95,5.38,"02/04/2012",,2012-04-02,"2012","04","02",5.79
"K26","A",14.16,5.43,0,0,0.5,8.81,"02/04/2012",,2012-04-02,"2012","04","02",8.73
"K26","B",22.79,5.43,0,1.76,2.22,14.22,"02/04/2012",,2012-04-02,"2012","04","02",17.36
"K26","C",10.47,5.43,0,0,0.43,5.16,"02/04/2012",,2012-04-02,"2012","04","02",5.04
"K26","D",9.64,5.43,0,0.36,0.18,4.36,"02/04/2012",,2012-04-02,"2012","04","02",4.21
"K27","A",14.26,5.43,0,0.85,1.03,7.8,"02/04/2012",,2012-04-02,"2012","04","02",8.83
"K27","B",13.11,5.43,0,0,0.23,7.94,"02/04/2012",,2012-04-02,"2012","04","02",7.68
"K27","C",8.44,5.43,0,0,0.69,2.75,"02/04/2012",,2012-04-02,"2012","04","02",3.01
"K27","D",10.27,5.43,0,0,0.43,4.94,"02/04/2012",,2012-04-02,"2012","04","02",4.84
"E21","A",8.37,5.36,0,0,0,8.37,"16/04/2012",,2012-04-16,"2012","04","16",3.01
"E21","B",30.16,5.36,0,0,3.04,23.61,"16/04/2012",,2012-04-16,"2012","04","16",24.8
"E21","C",11.16,5.36,0,0,0.5,5.77,"16/04/2012",,2012-04-16,"2012","04","16",5.8
"E21","D",7.35,5.36,0,0,0,7.53,"16/04/2012",,2012-04-16,"2012","04","16",1.99
"E22","A",9.03,5.36,0,0,0.06,3.91,"16/04/2012",,2012-04-16,"2012","04","16",3.67
"E22","B",10.1,5.36,0,0,0.06,5.06,"16/04/2012",,2012-04-16,"2012","04","16",4.74
"E22","C",10.1,5.36,0,0.57,0.21,5.63,"16/04/2012",,2012-04-16,"2012","04","16",4.74
"E22","D",15.09,5.36,0,0.92,1.02,5.69,"16/04/2012",,2012-04-16,"2012","04","16",9.73
"E26","A",10.92,5.36,0,0,0.63,5.34,"16/04/2012",,2012-04-16,"2012","04","16",5.56
"E26","B",9.32,5.36,0,0,0.06,4.33,"16/04/2012",,2012-04-16,"2012","04","16",3.96
"E26","C",15.24,5.36,0,9.3,0.06,1.31,"16/04/2012",,2012-04-16,"2012","04","16",9.88
"E26","D",14.05,5.36,0,1.67,0.06,7.65,"16/04/2012",,2012-04-16,"2012","04","16",8.69
"E27","A",16.23,5.36,0,0.95,0.8,10.1,"16/04/2012",,2012-04-16,"2012","04","16",10.87
"E27","B",16.36,5.36,0,5.68,0.13,5.41,"16/04/2012",,2012-04-16,"2012","04","16",11
"E27","C",8.3,5.36,0,0,0.22,3.09,"16/04/2012",,2012-04-16,"2012","04","16",2.94
"E27","D",13.97,5.36,0,0,0,13.97,"16/04/2012",,2012-04-16,"2012","04","16",8.61
"F21","A",18.33,5.36,0,0,0.05,14.29,"16/04/2012",,2012-04-16,"2012","04","16",12.97
"F21","B",12.76,5.36,0,0,0.52,7.65,"16/04/2012",,2012-04-16,"2012","04","16",7.4
"F21","C",8.26,5.36,0,0,0,8.26,"16/04/2012",,2012-04-16,"2012","04","16",2.9
"F21","D",14.17,5.36,0,0,0.53,9.54,"16/04/2012",,2012-04-16,"2012","04","16",8.81
"F22","A",17.31,5.36,0,0,0.1,12.8,"16/04/2012",,2012-04-16,"2012","04","16",11.95
"F22","B",17.33,5.36,0,0,0.4,12.74,"16/04/2012",,2012-04-16,"2012","04","16",11.97
"F22","C",8.21,5.36,0,0,0.46,3.91,"16/04/2012",,2012-04-16,"2012","04","16",2.85
"F22","D",12.39,5.36,0,0,0,12.39,"16/04/2012",,2012-04-16,"2012","04","16",7.03
"F26","A",11.66,5.36,0,0,0,11.66,"16/04/2012",,2012-04-16,"2012","04","16",6.3
"F26","B",12.55,5.36,0,0.56,0.59,6.82,"16/04/2012",,2012-04-16,"2012","04","16",7.19
"F26","C",14.87,5.36,0,0,0.36,9.96,"16/04/2012",,2012-04-16,"2012","04","16",9.51
"F26","D",9.44,5.36,0,0.2,0,4.28,"16/04/2012",,2012-04-16,"2012","04","16",4.08
"F27","A",16.43,5.36,0,0.2,0.11,11.51,"16/04/2012",,2012-04-16,"2012","04","16",11.07
"F27","B",9.71,5.36,0,0,0.05,4.86,"16/04/2012",,2012-04-16,"2012","04","16",4.35
"F27","C",21.29,5.36,0,12,0.2,4.7,"16/04/2012",,2012-04-16,"2012","04","16",15.93
"F27","D",6.35,5.36,0,0,0,6.35,"16/04/2012",,2012-04-16,"2012","04","16",0.989999999999999
"J21","A",12.14,5.36,0,0,1.1,6.22,"16/04/2012",,2012-04-16,"2012","04","16",6.78
"J21","B",13.39,5.36,0,0,0.51,8.36,"16/04/2012",,2012-04-16,"2012","04","16",8.03
"J21","C",10.13,5.36,0,0,0.53,4.74,"16/04/2012",,2012-04-16,"2012","04","16",4.77
"J21","D",15.47,5.36,0,0,4.59,6.1,"16/04/2012",,2012-04-16,"2012","04","16",10.11
"J22","A",14.76,5.36,0,0,0.14,10.03,"16/04/2012",,2012-04-16,"2012","04","16",9.4
"J22","B",7.47,5.36,0,0,0,7.47,"16/04/2012",,2012-04-16,"2012","04","16",2.11
"J22","C",7.94,5.36,0,0,0.08,2.9,"16/04/2012",,2012-04-16,"2012","04","16",2.58
"J22","D",12.42,5.36,0,1.24,0.33,7.2,"16/04/2012",,2012-04-16,"2012","04","16",7.06
"J26","A",12.87,5.36,0,0.14,0.42,6.57,"16/04/2012",,2012-04-16,"2012","04","16",7.51
"J26","B",19.73,5.36,0,9.74,0.12,2.23,"16/04/2012",,2012-04-16,"2012","04","16",14.37
"J26","C",16.96,5.36,0,0,0.12,2.23,"16/04/2012",,2012-04-16,"2012","04","16",11.6
"J26","D",14.5,5.36,0,0,0.86,9.28,"16/04/2012",,2012-04-16,"2012","04","16",9.14
"J27","A",10.29,5.36,0,0,0.2,5.33,"16/04/2012",,2012-04-16,"2012","04","16",4.93
"J27","B",9.68,5.36,0,0.07,0.08,4.78,"16/04/2012",,2012-04-16,"2012","04","16",4.32
"J27","C",9.17,5.36,0,0,0,9.17,"16/04/2012",,2012-04-16,"2012","04","16",3.81
"J27","D",10.26,5.36,0,0,0.05,5.5,"16/04/2012",,2012-04-16,"2012","04","16",4.9
"K21","A",12.87,5.36,0,0,1.82,6.25,"16/04/2012",,2012-04-16,"2012","04","16",7.51
"K21","B",9.5,5.36,0,0.26,0.34,4.26,"16/04/2012",,2012-04-16,"2012","04","16",4.14
"K21","C",8.66,5.36,0,0,0,8.66,"16/04/2012",,2012-04-16,"2012","04","16",3.3
"K21","D",15.95,5.36,0,0,0.58,11.01,"16/04/2012",,2012-04-16,"2012","04","16",10.59
"K22","A",13.51,5.36,0,0,0.39,8.65,"16/04/2012",,2012-04-16,"2012","04","16",8.15
"K22","B",11.33,5.36,0,0,0.05,6.43,"16/04/2012",,2012-04-16,"2012","04","16",5.97
"K22","C",13.37,5.36,0,0.21,0.2,8.68,"16/04/2012",,2012-04-16,"2012","04","16",8.01
"K22","D",10.65,5.36,0,0,0,10.5,"16/04/2012",,2012-04-16,"2012","04","16",5.29
"K26","A",11.46,5.36,0,0.37,1.69,4.49,"16/04/2012",,2012-04-16,"2012","04","16",6.1
"K26","B",35.29,5.36,0,2.2,10.51,19.31,"16/04/2012",,2012-04-16,"2012","04","16",29.93
"K26","C",9.96,5.36,0,0,3.33,1.7,"16/04/2012",,2012-04-16,"2012","04","16",4.6
"K26","D",8,5.36,0,0,0.13,2.77,"16/04/2012",,2012-04-16,"2012","04","16",2.64
"K27","A",10.09,5.36,0,0.42,0.21,4.7,"16/04/2012",,2012-04-16,"2012","04","16",4.73
"K27","B",8.06,5.36,0,0,0.09,2.93,"16/04/2012",,2012-04-16,"2012","04","16",2.7
"K27","C",9.09,5.36,0,0,0.11,3.99,"16/04/2012",,2012-04-16,"2012","04","16",3.73
"K27","D",7.86,5.36,0,0,0.05,2.74,"16/04/2012",,2012-04-16,"2012","04","16",2.5
"E21","A",30.92,9.02,0,0.15,0.6,21.85,"01/05/2012",,2012-05-01,"2012","05","01",21.9
"E21","B",13.41,9.02,0,0,0.59,4.05,"01/05/2012",,2012-05-01,"2012","05","01",4.39
"E21","C",11.8,9.02,0,0,0.31,2.87,"01/05/2012",,2012-05-01,"2012","05","01",2.78
"E21","D",14.52,9.02,0,0,0.59,5.24,"01/05/2012",,2012-05-01,"2012","05","01",5.5
"E22","A",14.42,9.02,0,0.03,0,5.71,"01/05/2012",,2012-05-01,"2012","05","01",5.4
"E22","B",13.21,9.02,0,0,0.18,4.25,"01/05/2012",,2012-05-01,"2012","05","01",4.19
"E22","C",16.4,9.02,0,0,0,16.4,"01/05/2012",,2012-05-01,"2012","05","01",7.38
"E22","D",29.46,9.02,0,0.64,4.48,15.86,"01/05/2012",,2012-05-01,"2012","05","01",20.44
"E26","A",14.88,9.02,0,0,0,14.88,"01/05/2012",,2012-05-01,"2012","05","01",5.86
"E26","B",11.29,9.02,0,2.88,0.16,1.99,"01/05/2012",,2012-05-01,"2012","05","01",2.27
"E26","C",13.13,9.02,0,0,0.12,1.26,"01/05/2012",,2012-05-01,"2012","05","01",4.11
"E26","D",16.17,9.02,0,0.62,0.48,6.39,"01/05/2012",,2012-05-01,"2012","05","01",7.15
"E27","A",22.98,9.02,0,0.68,2.06,11.79,"01/05/2012",,2012-05-01,"2012","05","01",13.96
"E27","B",12.85,9.02,0,0,0.79,3.22,"01/05/2012",,2012-05-01,"2012","05","01",3.83
"E27","C",14.4,9.02,0,0,0.43,5.25,"01/05/2012",,2012-05-01,"2012","05","01",5.38
"E27","D",13.89,9.02,0,0.13,0.32,4.44,"01/05/2012",,2012-05-01,"2012","05","01",4.87
"F21","A",22.39,9.02,0,0,0,22.39,"01/05/2012",,2012-05-01,"2012","05","01",13.37
"F21","B",16,9.02,0,0.11,0.26,6.89,"01/05/2012",,2012-05-01,"2012","05","01",6.98
"F21","C",12.3,9.02,0,0,0,12.3,"01/05/2012",,2012-05-01,"2012","05","01",3.28
"F21","D",19.8,9.02,0,0,0.48,9.78,"01/05/2012",,2012-05-01,"2012","05","01",10.78
"F22","A",24.48,9.02,0,0,0.58,15.37,"01/05/2012",,2012-05-01,"2012","05","01",15.46
"F22","B",21.97,9.02,0,0,0.08,12.27,"01/05/2012",,2012-05-01,"2012","05","01",12.95
"F22","C",13.6,9.02,0,0,0.05,4.67,"01/05/2012",,2012-05-01,"2012","05","01",4.58
"F22","D",14.53,9.02,0,0,0.07,5.74,"01/05/2012",,2012-05-01,"2012","05","01",5.51
"F26","A",18.14,9.02,0,0,0,18.14,"01/05/2012",,2012-05-01,"2012","05","01",9.12
"F26","B",13.46,9.02,0,0.19,0.23,4.24,"01/05/2012",,2012-05-01,"2012","05","01",4.44
"F26","C",17.24,9.02,0,0,0.13,8.48,"01/05/2012",,2012-05-01,"2012","05","01",8.22
"F26","D",11.85,9.02,0,0,0.23,2.84,"01/05/2012",,2012-05-01,"2012","05","01",2.83
"F27","A",16.73,9.02,0,0.15,0.17,7.68,"01/05/2012",,2012-05-01,"2012","05","01",7.71
"F27","B",16.56,9.02,0,0,0.63,7.17,"01/05/2012",,2012-05-01,"2012","05","01",7.54
"F27","C",13.91,9.02,0,0.08,0,4.93,"01/05/2012",,2012-05-01,"2012","05","01",4.89
"F27","D",23.83,9.02,0,4.31,1.08,9.42,"01/05/2012",,2012-05-01,"2012","05","01",14.81
"J21","A",14.38,9.02,0,0,0,14.38,"01/05/2012",,2012-05-01,"2012","05","01",5.36
"J21","B",15.65,9.02,0,0.17,0.43,6.22,"01/05/2012",,2012-05-01,"2012","05","01",6.63
"J21","C",14.63,9.02,0,0,1.36,4.47,"01/05/2012",,2012-05-01,"2012","05","01",5.61
"J21","D",16.22,9.02,0,0,3.77,3.67,"01/05/2012",,2012-05-01,"2012","05","01",7.2
"J22","A",17.36,9.02,0,0,0.14,8.57,"01/05/2012",,2012-05-01,"2012","05","01",8.34
"J22","B",15.15,9.02,0,0,0.82,5.66,"01/05/2012",,2012-05-01,"2012","05","01",6.13
"J22","C",11.61,9.02,0,0,0,11.61,"01/05/2012",,2012-05-01,"2012","05","01",2.59
"J22","D",12.28,9.02,0,0,0.44,3,"01/05/2012",,2012-05-01,"2012","05","01",3.26
"J26","A",17.8,9.02,0,0.84,0.15,8.02,"01/05/2012",,2012-05-01,"2012","05","01",8.78
"J26","B",19.22,9.02,0,0.19,0.36,10.05,"01/05/2012",,2012-05-01,"2012","05","01",10.2
"J26","C",18.5,9.02,0,2.58,0.17,6.78,"01/05/2012",,2012-05-01,"2012","05","01",9.48
"J26","D",15.1,9.02,0,0,0.29,5.91,"01/05/2012",,2012-05-01,"2012","05","01",6.08
"J27","A",13.26,9.02,0,0,0.14,4.45,"01/05/2012",,2012-05-01,"2012","05","01",4.24
"J27","B",11.43,9.02,0,0.12,0,2.43,"01/05/2012",,2012-05-01,"2012","05","01",2.41
"J27","C",11.28,9.02,0,0,0.12,2.37,"01/05/2012",,2012-05-01,"2012","05","01",2.26
"J27","D",13.35,9.02,0,0.29,0,4.29,"01/05/2012",,2012-05-01,"2012","05","01",4.33
"K21","A",28.03,9.02,0,0,2.9,16.65,"01/05/2012",,2012-05-01,"2012","05","01",19.01
"K21","B",13.33,9.02,0,0,0.84,3.54,"01/05/2012",,2012-05-01,"2012","05","01",4.31
"K21","C",15.23,9.02,0,0.42,0.77,5.37,"01/05/2012",,2012-05-01,"2012","05","01",6.21
"K21","D",16.89,9.02,0,0,0.15,8.09,"01/05/2012",,2012-05-01,"2012","05","01",7.87
"K22","A",24.07,9.02,0,0,4.3,11.1,"01/05/2012",,2012-05-01,"2012","05","01",15.05
"K22","B",15.29,9.02,0,0,0.21,6.34,"01/05/2012",,2012-05-01,"2012","05","01",6.27
"K22","C",13.31,9.02,0,0,0.09,4.55,"01/05/2012",,2012-05-01,"2012","05","01",4.29
"K22","D",16.36,9.02,0,0,0.09,7.58,"01/05/2012",,2012-05-01,"2012","05","01",7.34
"K26","A",11.63,9.02,0,0.17,0,2.67,"01/05/2012",,2012-05-01,"2012","05","01",2.61
"K26","B",13.39,9.02,0,1.61,0,2.99,"01/05/2012",,2012-05-01,"2012","05","01",4.37
"K26","C",10.55,9.02,0,0.3,0.15,1.23,"01/05/2012",,2012-05-01,"2012","05","01",1.53
"K26","D",10.1,9.02,0,0,0.1,1.19,"01/05/2012",,2012-05-01,"2012","05","01",1.08
"K27","A",15.36,9.02,0,0,0.24,6.15,"01/05/2012",,2012-05-01,"2012","05","01",6.34
"K27","B",14.61,9.02,0,0.23,0.1,5.53,"01/05/2012",,2012-05-01,"2012","05","01",5.59
"K27","C",11.8,9.02,0,0,0,11.8,"01/05/2012",,2012-05-01,"2012","05","01",2.78
"K27","D",13.99,9.02,0,0,0.06,5.23,"01/05/2012",,2012-05-01,"2012","05","01",4.97
"E21","A",32.58,7.74,0,0,0,32.58,"15/05/2012",,2012-05-15,"2012","05","15",24.84
"E21","B",12.32,7.74,0,0,0,12.32,"15/05/2012",,2012-05-15,"2012","05","15",4.58
"E21","C",11.09,7.74,0,0,0,11.09,"15/05/2012",,2012-05-15,"2012","05","15",3.35
"E21","D",11.49,7.74,0,1.09,0,3.39,"15/05/2012",,2012-05-15,"2012","05","15",3.75
"E22","A",12.39,7.74,0,0.26,0.08,5.2,"15/05/2012",,2012-05-15,"2012","05","15",4.65
"E22","B",18.94,7.74,0,0.06,0.23,3.49,"15/05/2012",,2012-05-15,"2012","05","15",11.2
"E22","C",21.38,7.74,0,0.28,0,14.64,"15/05/2012",,2012-05-15,"2012","05","15",13.64
"E22","D",10.84,7.74,0,0.42,4.99,6.7,"15/05/2012",,2012-05-15,"2012","05","15",3.1
"E26","A",9.74,7.74,0,0,0,9.74,"15/05/2012",,2012-05-15,"2012","05","15",2
"E26","B",11.81,7.74,0,0,0,11.81,"15/05/2012",,2012-05-15,"2012","05","15",4.07
"E26","C",8.21,7.74,0,0.15,0,0.88,"15/05/2012",,2012-05-15,"2012","05","15",0.470000000000001
"E26","D",12.97,7.74,0,0,0.27,5.59,"15/05/2012",,2012-05-15,"2012","05","15",5.23
"E27","A",16.85,7.74,0,0,0.71,9.19,"15/05/2012",,2012-05-15,"2012","05","15",9.11
"E27","B",9.57,7.74,0,0,0.23,2.1,"15/05/2012",,2012-05-15,"2012","05","15",1.83
"E27","C",15.23,7.74,0,0,0,15.23,"15/05/2012",,2012-05-15,"2012","05","15",7.49
"E27","D",12.44,7.74,0,0.08,0.21,5.15,"15/05/2012",,2012-05-15,"2012","05","15",4.7
"F21","A",21.37,7.74,0,0,0,21.37,"15/05/2012",,2012-05-15,"2012","05","15",13.63
"F21","B",14.15,7.74,0,0.3,0.11,6.75,"15/05/2012",,2012-05-15,"2012","05","15",6.41
"F21","C",15.05,7.74,0,0,0.27,7.85,"15/05/2012",,2012-05-15,"2012","05","15",7.31
"F21","D",22.5,7.74,0,0,0.33,15.46,"15/05/2012",,2012-05-15,"2012","05","15",14.76
"F22","A",26.75,7.74,0,0,0,26.75,"15/05/2012",,2012-05-15,"2012","05","15",19.01
"F22","B",25.4,7.74,0,0,0.73,17.92,"15/05/2012",,2012-05-15,"2012","05","15",17.66
"F22","C",15.53,7.74,0,0,1.03,7.58,"15/05/2012",,2012-05-15,"2012","05","15",7.79
"F22","D",17.67,7.74,0,0,0,17.67,"15/05/2012",,2012-05-15,"2012","05","15",9.93
"F26","A",21.03,7.74,0,0,0,21.03,"15/05/2012",,2012-05-15,"2012","05","15",13.29
"F26","B",11.12,7.74,0,0,0,11.12,"15/05/2012",,2012-05-15,"2012","05","15",3.38
"F26","C",20.27,7.74,0,0,0.07,13.36,"15/05/2012",,2012-05-15,"2012","05","15",12.53
"F26","D",12.26,7.74,0,0,0.42,4.74,"15/05/2012",,2012-05-15,"2012","05","15",4.52
"F27","A",15.94,7.74,0,0.17,0.08,8.78,"15/05/2012",,2012-05-15,"2012","05","15",8.2
"F27","B",14.96,7.74,0,0,0.03,7.77,"15/05/2012",,2012-05-15,"2012","05","15",7.22
"F27","C",13.74,7.74,0,0.8,0.42,5.58,"15/05/2012",,2012-05-15,"2012","05","15",6
"F27","D",15.58,7.74,0,0,0,15.58,"15/05/2012",,2012-05-15,"2012","05","15",7.84
"J21","A",16.73,7.74,0,0,0,16.73,"15/05/2012",,2012-05-15,"2012","05","15",8.99
"J21","B",14.06,7.74,0,0.18,0.45,6.4,"15/05/2012",,2012-05-15,"2012","05","15",6.32
"J21","C",16.33,7.74,0,0,0,16.33,"15/05/2012",,2012-05-15,"2012","05","15",8.59
"J21","D",18.26,7.74,0,0,2.9,8.48,"15/05/2012",,2012-05-15,"2012","05","15",10.52
"J22","A",13.38,7.74,0,0,0.38,6.04,"15/05/2012",,2012-05-15,"2012","05","15",5.64
"J22","B",13.02,7.74,0,0.19,0,5.79,"15/05/2012",,2012-05-15,"2012","05","15",5.28
"J22","C",9.72,7.74,0,0,0,9.72,"15/05/2012",,2012-05-15,"2012","05","15",1.98
"J22","D",14.13,7.74,0,0,0.24,6.97,"15/05/2012",,2012-05-15,"2012","05","15",6.39
"J26","A",14.54,7.74,0,0.23,0.04,7.4,"15/05/2012",,2012-05-15,"2012","05","15",6.8
"J26","B",20.04,7.74,0,0.59,0.3,12.54,"15/05/2012",,2012-05-15,"2012","05","15",12.3
"J26","C",19.57,7.74,0,6.19,0.72,5.65,"15/05/2012",,2012-05-15,"2012","05","15",11.83
"J26","D",16.44,7.74,0,0,0,16.44,"15/05/2012",,2012-05-15,"2012","05","15",8.7
"J27","A",18.78,7.74,0,0,0.21,11.78,"15/05/2012",,2012-05-15,"2012","05","15",11.04
"J27","B",13.05,7.74,0,0,0.26,5.85,"15/05/2012",,2012-05-15,"2012","05","15",5.31
"J27","C",11.47,7.74,0,0,0,11.47,"15/05/2012",,2012-05-15,"2012","05","15",3.73
"J27","D",15.17,7.74,0,0,0,15.17,"15/05/2012",,2012-05-15,"2012","05","15",7.43
"K21","A",15.34,7.74,0,0,0.18,8.23,"15/05/2012",,2012-05-15,"2012","05","15",7.6
"K21","B",11.81,7.74,0,0,0.26,4.4,"15/05/2012",,2012-05-15,"2012","05","15",4.07
"K21","C",13.01,7.74,0,0,0.3,5.62,"15/05/2012",,2012-05-15,"2012","05","15",5.27
"K21","D",11.24,7.74,0,0,0.09,3.97,"15/05/2012",,2012-05-15,"2012","05","15",3.5
"K22","A",18.99,7.74,0,0,0.89,11.5,"15/05/2012",,2012-05-15,"2012","05","15",11.25
"K22","B",27.36,7.74,0,0,0.08,20.94,"15/05/2012",,2012-05-15,"2012","05","15",19.62
"K22","C",11.16,7.74,0,0,0.26,3.71,"15/05/2012",,2012-05-15,"2012","05","15",3.42
"K22","D",11.42,7.74,0,0,0.12,4.08,"15/05/2012",,2012-05-15,"2012","05","15",3.68
"K26","A",15.38,7.74,0,1.02,0.34,7.14,"15/05/2012",,2012-05-15,"2012","05","15",7.64
"K26","B",11.2,7.74,0,0.28,0.66,3.24,"15/05/2012",,2012-05-15,"2012","05","15",3.46
"K26","C",11.74,7.74,0,0,0,11.74,"15/05/2012",,2012-05-15,"2012","05","15",4
"K26","D",11.5,7.74,0,0,0,11.5,"15/05/2012",,2012-05-15,"2012","05","15",3.76
"K27","A",13.34,7.74,0,0,0,13.34,"15/05/2012",,2012-05-15,"2012","05","15",5.6
"K27","B",13.82,7.74,0,0,1.9,4.93,"15/05/2012",,2012-05-15,"2012","05","15",6.08
"K27","C",13.22,7.74,0,0,0,13.22,"15/05/2012",,2012-05-15,"2012","05","15",5.48
"K27","D",11.66,7.74,0,0,0.16,4.33,"15/05/2012",,2012-05-15,"2012","05","15",3.92
"E21","A",28.26,8.18,0,0,0,20.08,"01/06/2012",,2012-06-01,"2012","06","01",20.08
"E21","B",15.08,8.23,0,0,0.55,6.81,"01/06/2012",,2012-06-01,"2012","06","01",6.85
"E21","C",13.45,8.17,0,0,1.03,4.61,"01/06/2012",,2012-06-01,"2012","06","01",5.28
"E21","D",17.68,8.27,0,0,0.93,9,"01/06/2012",,2012-06-01,"2012","06","01",9.41
"E22","A",12.56,8.15,0.43,0,0,4.18,"01/06/2012",,2012-06-01,"2012","06","01",4.41
"E22","B",16.56,8.1,0,0,0.25,8.52,"01/06/2012",,2012-06-01,"2012","06","01",8.46
"E22","C",25.07,8.15,0,0.79,0,16.86,"01/06/2012",,2012-06-01,"2012","06","01",16.92
"E22","D",20.27,8.12,0,0.55,3.49,8.5,"01/06/2012",,2012-06-01,"2012","06","01",12.15
"E26","A",14.6,8.18,0,0.15,0,6.69,"01/06/2012",,2012-06-01,"2012","06","01",6.42
"E26","B",15.99,8.08,0,0,0,7.91,"01/06/2012",,2012-06-01,"2012","06","01",7.91
"E26","C",12.23,8.1,0,0.09,0,4.38,"01/06/2012",,2012-06-01,"2012","06","01",4.13
"E26","D",25.08,8.17,0,0,0.31,17.27,"01/06/2012",,2012-06-01,"2012","06","01",16.91
"E27","A",17.54,8.09,0,0,0.08,9.87,"01/06/2012",,2012-06-01,"2012","06","01",9.45
"E27","B",12.88,8.15,0,0,0.96,4.09,"01/06/2012",,2012-06-01,"2012","06","01",4.73
"E27","C",16.61,8.03,0,0,3.66,5.21,"01/06/2012",,2012-06-01,"2012","06","01",8.58
"E27","D",14.35,8.1,0,0,0.21,6.52,"01/06/2012",,2012-06-01,"2012","06","01",6.25
"F21","A",16.69,8.18,0,0,0,8.51,"01/06/2012",,2012-06-01,"2012","06","01",8.51
"F21","B",23.69,8.12,0,0,0.39,15.78,"01/06/2012",,2012-06-01,"2012","06","01",15.57
"F21","C",13.48,8.15,0,0,0,5.33,"01/06/2012",,2012-06-01,"2012","06","01",5.33
"F21","D",33.18,8.29,0,0,2.25,23.9,"01/06/2012",,2012-06-01,"2012","06","01",24.89
"F22","A",36.88,8.18,0,0,0,28.7,"01/06/2012",,2012-06-01,"2012","06","01",28.7
"F22","B",20.12,8.12,0,0,0.3,12.07,"01/06/2012",,2012-06-01,"2012","06","01",12
"F22","C",11.35,8.17,0,0,0,3.18,"01/06/2012",,2012-06-01,"2012","06","01",3.18
"F22","D",29.46,8.18,0,0,1.06,20.78,"01/06/2012",,2012-06-01,"2012","06","01",21.28
"F26","A",28.95,8.12,0,0,0,20.83,"01/06/2012",,2012-06-01,"2012","06","01",20.83
"F26","B",16.13,8.18,0,0,0,7.95,"01/06/2012",,2012-06-01,"2012","06","01",7.95
"F26","C",21.47,8.1,0,0,0,13.37,"01/06/2012",,2012-06-01,"2012","06","01",13.37
"F26","D",13.53,8.12,0,0.41,0,5.39,"01/06/2012",,2012-06-01,"2012","06","01",5.41
"F27","A",19.97,8.23,0,0,0.08,12.17,"01/06/2012",,2012-06-01,"2012","06","01",11.74
"F27","B",20.77,8.1,0,0.03,1.98,11.24,"01/06/2012",,2012-06-01,"2012","06","01",12.67
"F27","C",10.81,8.13,0,0,0.02,2.93,"01/06/2012",,2012-06-01,"2012","06","01",2.68
"F27","D",24.1,8.03,0,0.21,0.26,16.16,"01/06/2012",,2012-06-01,"2012","06","01",16.07
"J21","A",25.71,8.05,3.84,0,0.3,14.12,"01/06/2012",,2012-06-01,"2012","06","01",17.66
"J21","B",15.29,8.19,0,0,0,7.1,"01/06/2012",,2012-06-01,"2012","06","01",7.1
"J21","C",15.87,8.06,0,0,0.54,7.52,"01/06/2012",,2012-06-01,"2012","06","01",7.81
"J21","D",23.81,8.16,0,0,0.38,15.96,"01/06/2012",,2012-06-01,"2012","06","01",15.65
"J22","A",20.98,8.1,0,0,0,12.88,"01/06/2012",,2012-06-01,"2012","06","01",12.88
"J22","B",19.3,8.02,0,0.32,4.49,6.81,"01/06/2012",,2012-06-01,"2012","06","01",11.28
"J22","C",17.83,8.07,0,0,0.16,9.96,"01/06/2012",,2012-06-01,"2012","06","01",9.76
"J22","D",16.6,8.01,0,0,0.81,8.07,"01/06/2012",,2012-06-01,"2012","06","01",8.59
"J26","A",21.34,8.03,2.22,0,0.44,11.25,"01/06/2012",,2012-06-01,"2012","06","01",13.31
"J26","B",28.92,8.15,0,0.18,0.27,21.13,"01/06/2012",,2012-06-01,"2012","06","01",20.77
"J26","C",15.33,8.09,0,0.71,0.05,6.84,"01/06/2012",,2012-06-01,"2012","06","01",7.24
"J26","D",24.13,8.21,2.75,0,0.78,12.69,"01/06/2012",,2012-06-01,"2012","06","01",15.92
"J27","A",29.01,8.12,0,0,0.19,21.37,"01/06/2012",,2012-06-01,"2012","06","01",20.89
"J27","B",19.52,8.13,0,0,0.32,11.48,"01/06/2012",,2012-06-01,"2012","06","01",11.39
"J27","C",15.43,8.02,0,0,0.13,7.63,"01/06/2012",,2012-06-01,"2012","06","01",7.41
"J27","D",19.16,8.15,0,0,3.48,7.9,"01/06/2012",,2012-06-01,"2012","06","01",11.01
"K21","A",20.44,8.17,0,0,1.22,11.74,"01/06/2012",,2012-06-01,"2012","06","01",12.27
"K21","B",17.98,8.05,0,0,1.16,9.22,"01/06/2012",,2012-06-01,"2012","06","01",9.93
"K21","C",14.84,8.1,0,0,0.32,6.73,"01/06/2012",,2012-06-01,"2012","06","01",6.74
"K21","D",12.34,8.11,0,0.22,2.24,2.12,"01/06/2012",,2012-06-01,"2012","06","01",4.23
"K22","A",18.24,8.12,0,0,1.27,9.48,"01/06/2012",,2012-06-01,"2012","06","01",10.12
"K22","B",24.97,8.16,0,0,0.99,16.84,"01/06/2012",,2012-06-01,"2012","06","01",16.81
"K22","C",14.92,8.11,0,0,0.78,6.28,"01/06/2012",,2012-06-01,"2012","06","01",6.81
"K22","D",15.58,8.1,0,0,0.42,7.42,"01/06/2012",,2012-06-01,"2012","06","01",7.48
"K26","A",20,8.08,3.05,3.89,0.21,5.06,"01/06/2012",,2012-06-01,"2012","06","01",11.92
"K26","B",16.99,8.11,0,0,0.26,7.96,"01/06/2012",,2012-06-01,"2012","06","01",8.88
"K26","C",14.64,8.12,0,0,0.26,6.55,"01/06/2012",,2012-06-01,"2012","06","01",6.52
"K26","D",16.48,8.06,0,0,1.09,7.61,"01/06/2012",,2012-06-01,"2012","06","01",8.42
"K27","A",12.26,8.08,0,0,0.21,4.03,"01/06/2012",,2012-06-01,"2012","06","01",4.18
"K27","B",19.3,8.12,0,0,0.94,10.42,"01/06/2012",,2012-06-01,"2012","06","01",11.18
"K27","C",13.6,8.09,0,0,0.59,5.11,"01/06/2012",,2012-06-01,"2012","06","01",5.51
"K27","D",26.47,8.08,0,0,0.18,18.94,"01/06/2012",,2012-06-01,"2012","06","01",18.39
"E21","A",18.3,7.65,0,0,0.21,10.95,"15/06/2012",,2012-06-15,"2012","06","15",10.65
"E21","B",25.83,7.71,0,0,0.67,17.75,"15/06/2012",,2012-06-15,"2012","06","15",18.12
"E21","C",16.23,7.7,0,0.2,0.19,8.56,"15/06/2012",,2012-06-15,"2012","06","15",8.53
"E21","D",19.07,7.68,0,0,0.18,11.64,"15/06/2012",,2012-06-15,"2012","06","15",11.39
"E22","A",15.53,7.52,0,0.19,0,7.92,"15/06/2012",,2012-06-15,"2012","06","15",8.01
"E22","B",14.62,7.7,0.44,0,0.5,6.06,"15/06/2012",,2012-06-15,"2012","06","15",6.92
"E22","C",19.73,7.68,0,0,0.28,12.05,"15/06/2012",,2012-06-15,"2012","06","15",12.05
"E22","D",23.35,7.66,0,0.17,3.66,12.11,"15/06/2012",,2012-06-15,"2012","06","15",15.69
"E26","A",15.46,7.62,0.83,0.04,0.63,6.62,"15/06/2012",,2012-06-15,"2012","06","15",7.84
"E26","B",21.53,7.74,0,0,0.1,13.94,"15/06/2012",,2012-06-15,"2012","06","15",13.79
"E26","C",15.95,7.71,0,0,0,8.24,"15/06/2012",,2012-06-15,"2012","06","15",8.24
"E26","D",26.81,7.71,1.54,0,0.59,17.29,"15/06/2012",,2012-06-15,"2012","06","15",19.1
"E27","A",22.96,7.61,0,0,0,15.35,"15/06/2012",,2012-06-15,"2012","06","15",15.35
"E27","B",18.63,7.66,0,0,0.31,11.03,"15/06/2012",,2012-06-15,"2012","06","15",10.97
"E27","C",13.63,7.71,0,0,0.09,8.49,"15/06/2012",,2012-06-15,"2012","06","15",5.92
"E27","D",27.75,7.65,0,0,0,20.1,"15/06/2012",,2012-06-15,"2012","06","15",20.1
